asin,title
B00RBQ0AIS,"Windex Glass and Surface Wipes, Original, 28 ct"
B00RBPY4HW,GLD AIR Solid Gel HAWAIN BRZ 6OZ
B00RBPY7JC,"Glade Solid Air Freshener, Clean Linen, 6 oz"
B00RBPYJSQ,GLDE AEROSOL LAV &amp; Vanilla 8OZ
B00RBPZN6S,"Scrubbing Bubbles Fresh Gel Toilet Cleaning Stamp, Rainshower, Dispenser with 6 Stamps"
B00RCJT6IY,Glad ForceFlex OdorShield Tall Kitchen Drawstring Trash Bags - Gain Original and Febreze Freshness - 13 Gallon - 34 Count
B00REK0AC2,"Pringles&nbsp;Potato Crisps Chips, Original Flavored, Single Serve, Grab and Go,&nbsp;1.3 oz Can(Pack of 12)"
B00RGL7EAA,"belVita Cinnamon Brown Sugar Breakfast Biscuits, 1.76 Ounce, 8 Pack"
B00RGL76M6,"belVita Blueberry Breakfast Biscuits, 8 Count Box, 14.08 Ounce"
B00RGL7AJU,"belVita Golden Oat Breakfast Biscuits, 8 Count Box, 14.08 Ounce"
B00RGNGLHU,"Chips Ahoy! Chewy Reese's Peanut Butter Cup Chocolate Cookies, 9.5 Ounce"
B00RGNFT0A,"Chips Ahoy! Reese's Peanut Butter Cup Cookies, 9.5 Ounce"
B00RGNG25G,"Chips Ahoy! Chewy Reese's Peanut Butter Cup Cookies, 9.5 Ounce"
B00RGNGH1U,"Chips Ahoy! White Fudge Chunky Chocolate Chip Cookies, 11.75 Ounce"
B00RGNFO4G,"Chips Ahoy! Chunky Chocolate Chip Cookies, 11.75 Ounce (packaging may vary)"
B00RGNF71Q,"Chips Ahoy! Original Chocolate Chip Cookies, 13 Ounce (packaging may vary)"
B00RGNGQMU,"Chips Ahoy! Original Chocolate Chip Cookies - Family Size, 18.2 Ounce"
B00RGOY6A8,"Chips Ahoy! Mini Chocolate Chip Cookies, 12 Count Individual Snack Bags"
B00RGPHCUI,"Chips Ahoy Cookies Lunchbox Go-Paks, 3.5 oz"
B00RGR3LW4,"Wheat Thins Crackers (Zesty Salsa, 9-Ounce Box)"
B00RGR3FHU,"Wheat Thins Ranch Crackers, 9 Ounce"
B00RGR384A,"Ritz Toasted Chips, Veggie"
B00RGR3PA2,"Wheat Thins Popped Chips (Sour Cream &amp; Onion, 4.5-Ounce Bag)"
B00RGR3IR2,"Ritz Toasted Chips, Multigrain, 8.1 Ounce"
B00RGR3020,"Wheat Thins Sundried Tomato and Basil Crackers, 9 Ounce"
B00RGUTIJG,"Ritz Whole Wheat Crackers - Fresh Stacks, 11.6 Ounce"
B00RGUTLMA,"Ritz Original Crackers - Family Size, 20.6 Ounce"
B00RGUTPC6,"Ritz Reduced Fat Crackers, 12.5 Ounce"
B00RGVOUIO,"Ritz Peanut Butter Cracker Sandwiches, 8 Count Individual Snack Packs"
B00RTKEJCE,Glad OdorShield Tall Kitchen Drawstring Trash Bags - Febreze Island Fresh -  13 Gallon -  50 Count (Packaging May Vary)
B00RVC0RTY,"Jif Natural Peanut Butter Spread and Honey, 16 Ounce"
B00RVJ35VE,Source Naturals Alpha Lipoic Acid 300 mg Powerful Time Released Antioxidant (600 mg per serving) - 120 Tablets
B00RVJ1ZTI,"Deva Vegan Vitamins Daily Multivitamin Iron Free Tablets, 90 Count"
B00RVJ19B2,"Nutricology Delta-fraction Tocotrienols Softgels, 50 Mg, 75-Count"
B00RVJ4HZ2,Nature Made Stress B Complex w. key B Vitamins + Vitamin C &amp; Zinc Tablets 75 Ct
B00RVJ56PM,"One A Day Vitacraves Immunity Gummies, 150 Count"
B00RVJ2TVG,"Centrum Silver Adult (125 Count) Multivitamin/Multimineral Supplement Tablet, Vitamin D3, Age 50+"
B00RVJ1UIO,"Nature Made Super B Complex + Vitamin C Tablets, 360 Count"
B00RVJ1OK8,"Now Foods Instant Soy Milk Powder, 20-Ounce"
B00RZHUL4G,"French Toast Crunch Cereal Box, 11.6 Ounce"
B00RZHU31C,"Cheerios Ancient Grains Breakfast Cereal, 9 oz"
B00RZHV0GY,"Kashi, Chewy Granola Bars, Chocolate Almond Sea Salt, Non-GMO Project Verified, 7.4 oz (6 Count)"
B00RZHVBJK,"Kashi Soft 'n Chewy Bar, Apple Cobbler, 5 Count"
B00S0MBX8S,"Honey Nut Chex Cereal, Gluten-Free Cereal, 12.5 oz Box"
B00S0PL614,"Special K Protein Almond Honey Oat Bar, 5 Count"
B00S4JFKGS,"Crazy Cups Coffee, Tea and Hot Chocolate Variety Sampler Pack for Keurig K-Cup Brewers, 30 Count"
B00SFCKDM0,"Silk Pure Almondmilk Dark Chocolate 8 Fluid Ounce (Pack of 6), Chocolate Flavored Non-Dairy Almond Milk, Individually Packaged"
B00SGSG9LC,"Colgin Mesquite Liquid Smoke, 4.0 Ounce"
B00SGSG3HC,"Campbell's Condensed Soup, Cream of Chicken &amp; Mushroom, 10.5 Ounce"
B00SGSFXSW,"Campbell's Chunky Savory Chicken with White &amp; Wild Rice Soup, 18.8 oz Can"
B00SGSF8E6,"TWIZZLERS Licorice Candy, Strawberry, 16 Ounce"
B00SGSKSIM,"Campbell's Chunky Chicken Broccoli Cheese with Potato Soup, 18.8 oz. Can"
B00SGSEQI0,"Annie's Macaroni &amp; Cheese, Rice Pasta &amp; Cheddar Gluten Free Mac and Cheese, Microwave Cups, 2 Cups, 2.01 oz Each"
B00SGSFE04,"AirHeads Candy Variety Bag, Individually Wrapped Assorted Fruit Mini Bars, Non Melting, 12 Ounce"
B00SGSHKHE,"V8 Splash Cherry Pomegranate, 64 oz. Bottle"
B00SGSF292,"Cap'n Crunch Breakfast Cereal, 20oz Box"
B00SGSGFMK,"JFC White Roasted Sesame Seeds, 8 Ounce"
B00SGSKWS8,"Pop-Tarts Gone Nutty!, Breakfast Toaster Pastries, Peanut Butter, 10.5 oz (6 Count)"
B00SGSL5FM,"Campbell's Chunky Spicy Chicken Quesadilla Soup, 18.8 oz. Can"
B00SGSGY08,"Orbit Spearmint Sugarfree Gum, 55 piece bottle"
B00SGSHEWK,"Chicken of the Sea Solid Albacore Tuna in Water, 5-Ounce"
B00SGSKF9O,"Campbell's Chunky Chicken Corn Chowder Soup,&nbsp; 18.8 oz. Can"
B00SGSL18S,"Campbell's Chunky Philly Style Cheesesteak Soup, 18.8 oz. Can"
B00SGSFT40,"18 Rabbits Jr. Organic Gluten Free Granola Bars, Chocolate Cherry (16 Count, 1.05 Ounce Each)"
B00SGSKJNQ,"V8 V-Fusion Refreshers, Peach Strawberry, 46 oz"
B00SH4KAUG,"Carrington Farms gluten free, hexane free, NON-GMO, free of hydrogenated and trans fats in a BPA free bottle, liquid coconut cooking oil, rosemary flavor, 16oz (ounces), Packaging May Vary"
B00SH4NJH2,"Idahoan Mashed Potatoes, Buttery Homestyle, 4-Ounce Package"
B00SH4K6YG,"Carrington Farms gluten free, hexane free, NON-GMO, free of hydrogenated and trans fats in a BPA free bottle, liquid coconut cooking oil, garlic flavor, 16oz (ounces), Packaging May Vary"
B00SH4OO08,"Campbell's Condensed Tomato Soup, 10.75 oz. Cans (4 pack)"
B00SH4O31S,"Peanut Butter &amp; Co. Peanut Butter, Non-GMO, Gluten Free, Vegan, Crunch Time, 16-Ounce Jar"
B00SH4OJAS,"Campbell's Condensed Cream of Mushroom Soup, 10.5 oz. Cans, 4 Count"
B00SH4NS64,"Idahoan Applewood Smoked Bacon Mashed Potatoes, Made with Naturally Gluten-Free 100% Real Idaho Potatoes, 4 Servings"
B00SH4OA2U,"Swanson 33% Less Sodium Broth, Chicken, 32 Ounce (Pack of 6)"
B00SH4NWH4,"Idahoan Mashed Potatoes, Baby Reds with Roasted Garlic and Parmesan, 4.1 Ounce"
B00SH4OG2O,"Peanut Butter &amp; Co. Non-GMO, Gluten Free, Vegan Peanut Butter, Dark Chocolate Dreams, 16-Ounce Jar"
B00SH4OCR8,"Peanut Butter &amp; Co. Non-GMO, Gluten Free, Vegan Peanut Butter, Smooth Operator, 16-Ounce Jar"
B00SH4ORI2,"Campbell's Condensed Chicken Noodle Soup, 10.75 oz Can, (Pack of 4)"
B00SH4O68S,"Peanut Butter &amp; Co. Peanut Butter, Non-GMO, Gluten Free, Vegan, White Chocolate Wonderful, 16-Ounce Jar"
B00SHJ8KY4,Glad ForceFlex OdorShield Tall Kitchen Drawstring Trash Bags - Febreze Hawaiian Aloha - 13 Gallon - 34 Count
B00SHJAWT0,Glad Food Storage Containers - Glad OvenWare Containers - 96 Ounce - 2 Count
B00SHJ8GRA,Glad OdorShield Tall Kitchen Drawstring Trash Bags - Febreze Hawaiian Aloha - 13 Gallon - 40 Count
B00SHJ87CO,Glad Food Storage Containers - To Go Lunch Containers - 32 Ounce - 4 Containers
B00SIQ0SVE,NIVEA Care and Coconut Moisturizing Body Wash 16.9 Fluid Ounce
B00SIQ0QJS,NIVEA Men Sensitive Protective Lotion 2.5 Fluid Ounce
B00SIQ0VWK,Aquaphor Baby Advanced Therapy Healing Ointment Skin Protectant 3 Ounce Tube
B00SIQ0O22,NIVEA Men Sensitive Cooling Post Shave Balm 3.3 Fluid Ounce
B00SIQ00QC,"Cap'n Crunch Crunch Berries Breakfast Cereal, 18.7oz Box"
B00SIQ07AG,"Kellogg&rsquo;s Rice Krispies Breakfast Cereal, Toasted Rice Cereal, Fat-Free, 18 oz Box"
B00SMSFP1Q,"Kellogg&rsquo;s Corn Pops, Breakfast Cereal, Original, 12.5 oz Box"
B00SMYMMFW,"Chocolate Cheerios Gluten Free Breakfast Cereal, 22 oz"
B00SMYM9LO,"Trix Cereal, Fruit Flavored Corn Puffs Cereal, 18.4 oz"
B00SMYMZQI,"Cascadian Farm Organic Cereal, Cinnamon Crunch, Whole Grain Cereal, 9.2 oz"
B00SMYSHB0,"Chex Gluten Free Oatmeal, Variety Pack, 8.84 Ounce"
B00SMYSBI4,"Chex Gluten Free Oatmeal, Maple Brown Sugar, 9.54 Ounce"
B00SMYSO3Q,"Fruity Cheerios Gluten Free Breakfast Cereal, 12 oz"
B00SMYT6PG,"Honey Nut Cheerios Cereal Cup, Gluten Free Cereal, 1.8 oz (Pack of 12)"
B00SMYMTOG,"Banana Nut Cheerios Cereal, 10.9 Ounce"
B00SMYRSKQ,"Cinnamon Chex Cereal, Gluten Free Cereal, 12.1 oz"
B00SMYRZH2,"Corn Chex Cereal, Gluten-Free Cereal, 12 oz"
B00SMYNPU8,"Total Raisin Bran Cereal, 18.25-Ounce Box"
B00SMYMH3E,"Cookie Crisp Cereal, Chocolate Chip Cookie Flavored Cereal, 19.8 oz"
B00SMYNEXG,"Multi Grain Cheerios Gluten Free Breakfast Cereal, 9 oz"
B00SMYN6N4,"Cheerios Breakfast Cereal Cup, Toasted Whole Grain Oat Cereal, 1.3 oz Cup (Pack of 12)"
B00SMYRM9I,"Chex Cereal, Gluten Free, Apple Cinnamon, 12.4 Ounce"
B00SMYREPA,"Cascadian Farm Organic Granola, Cinnamon Raisin Cereal, 15.6 oz"
B00SST8FR0,"King Arthur Flour 100% Organic Unbleached All-Purpose Flour, 80 Ounce"
B00STFUH0G,"Finish Quantum Max Powerball, 64ct, Dishwasher Detergent Tablets, Ultimate Clean &amp; Shine"
B00STFVS68,"Velveeta Cheesy Bowls Lasagna with Meat Sauce, 9 oz"
B00STFVCNM,"Velveeta Cheesy Skillets Dinner Kit Box, Creamy Beef Stroganoff, 11.6 oz"
B00STFULFC,"Bull's Eye Original Barbecue Sauce, 18 Ounce Bottle"
B00STFVO4Y,"Betty Crocker White Chocolate Chip Macadamia Nut Cookie, 14 Ounce"
B00STFUQQQ,"Bull's Eye Kansas City Style Regional Barbecue Sauce, 18 Ounce Bottle"
B00SV10UDM,"Coffee Mate French Vanilla Liquid Coffee Creamer, 16 Fluid Ounce"
B00SV10RV2,"Coffee Mate Hazelnut Powder Coffee Creamer, 15 Ounce"
B00SV116EY,"Coffee Mate Coffee Creamer Sugar Free Vanilla Caramel, 10.2 Ounce"
B00SV11I8I,"Coffee-mate 2GO Hazelnut Triple Strength Liquid Coffee Creamer, 3 Fluid Ounce"
B00SV118WO,"Coffee Mate Coffee Creamer Powder, Original, 22 Ounce"
B00SV113R4,"Coffee-mate Caramel Macchiatto Powder Coffee Creamer, 15 Ounce"
B00SV11EF0,"Coffee-mate 2GO French Vanilla Triple Strength Liquid Coffee Creamer, 3 Fluid Ounce"
B00SV11L8K,"Coffee-mate 2GO Peppermint Mocha, 3 Fluid Ounce"
B00SV10X52,"Coffee-mate Hazelnut Liquid Coffee Creamer, 16 Fluid Ounce"
B00SV11BGM,"Coffee-mate 2GO Extra Sweet and Cremy Triple Strength Liquid Coffee Creamer, 3 Fluid Ounce"
B00SV10KSC,"Coffee-mate Original Powder Coffee Creamer, 16 Ounce"
B00SV110G8,"Coffee-mate Sugar Free Hazelnut Powder Coffee Creamer, 10.2 Ounce"
B00SV2P7FW,"Langers Juice Cocktail, Cranberry Raspberry, 64 Fluid Ounce"
B00SWRZE36,Glad Zipper Food Storage Plastic Bags- Gallon - 50 Count
B00SWRYYEG,Glad Food Storage Containers - Tall Entr&eacute;e Container - 42 Ounce - 3 Containers
B00SWRZ8NW,Glad Food Storage Containers - Variety Container Pack - 9 Containers - 18 Piece Set
B00SWRZLT8,"Swedish Fish Mini Soft &amp; Chewy Candy (Original, 14-Ounce Bag)"
B00SWV8TT8,"Similac Sensitive Infant Formula with Iron, For Fussiness and Gas, Baby Formula, Ready-to-Feed, 1 qt"
B00SWV903W,"Similac Alimentum Hypoallergenic Infant Formula for Food Allergies and Colic, Baby Formula, Ready-to-Feed, 1 qt"
B00SWV92YO,"Similac Isomil Ready to Feed, 32 Fluid Ounce"
B00SWV8X76,"Similac Expert Care NeoSure Ready to Feed, 32 Fluid Ounce"
B00SWV8INK,"Similac Advance Infant Formula with Iron, Baby Formula, Ready to Feed, 32 oz"
B00SX1MSCG,"SweeTARTS Mini Chewy Candy Resealable Bag, 12 Ounce"
B00SX1ONLK,"SweeTARTS Gummies Recloseable Bag, 11 Ounce"
B00SX1OFJA,"Spree Chewy Recloseable Bag, 12 Ounce"
B00SX1PHQ0,"Butterfinger Bites Recloseable Bag, 10 Ounce"
B00SX1P7HE,"Wonka Assorted Bag, 24.5 Ounce"
B00SX1PRK6,"Crunch Fun Size Bag, 11 Ounce"
B00SX1OY00,"Baby Ruth Fun Size Bag, 11.5 Ounce"
B00SX1NUIC,"Nestle Toll House Semi-Sweet Chocolate Morsels, 24 Ounce"
B00SX1PZRQ,NESTLE TOLL HOUSE Milk Chocolate Morsels 23 oz. Bag
B00SX1QTF8,"Skinny Cow Milk Chocolate Heavenly Crisp Candy Bars, 4.65 Ounce"
B00SX1QE1W,"Skinny Cow Divine Filled Caramel Chocolate Candy, 6 Ounce"
B00SX1UNBE,"Goobers Recloseable Bag, 11.5 Ounce"
B00SX1QLOC,"Nestle Toll House DelightFulls Milk Chocolate Morsels with Peanut Butter Filling, 9 Ounce"
B00SX1Q70U,"Nestle Toll House DelightFulls Milk Chocolate Morsels with Caramel Filling, 9 Ounce"
B00SX1TEKK,"Nestle Assorted Minis Bag, 11 Ounce"
B00SX25NPO,"Crunch Buncha Recloseable Bag, 9 Ounce"
B00SX1S6I6,"Skinny Cow Peanut Butter Milk Chocolate Heavenly Crisp Candy Bars, 4.65 Ounce"
B00SX1STCY,"Nestle Toll House DelightFulls Dark Chocolate Morsels with Mint Filling, 9 Ounce"
B00SX1U1CU,"Raisinets Dark Chocolate Recloseable Bag, 11 Ounce"
B00SX1VHTQ,"SweeTARTS Chewy Sours Candy Recloseable Bag, 11 Ounce"
B00SX1VAQQ,"Butterfinger Peanut Butter Cups Minis Unwrapped Recloseable Bag, 8 Ounce"
B00SX1SZLE,"Nestle Toll House DelightFulls Dark Chocolate Morsels with Cherry Filling, 9 Ounce"
B00SX1R14Q,NESTLE TOLL HOUSE Premier White Morsels 24 oz. Bag
B00SX1UFBW,"Skinny Cow Dark Chocolate Dreamy Cluster Candy, 6 Ounce"
B00T45VE9I,"Curel Rough Skin Rescue, 20 Ounce"
B00T45VSDA,"Jergens Natural Glow Daily Moisturizer for Body, Medium to Tan Skin Tones, 10 Ounce Pump"
B00T45UY1M,"Curel Ultra Healing Lotion, 20 Ounce"
B00T45VKX8,"Jergens Natural Glow Daily Moisturizer for Body, Fair to Medium Skin Tones, 10 Ounce Pump"
B00T45VOHU,"Jergens Ultra Healing Extra Dry Skin Moisturizer, 21 Ounces"
B00T45VHFO,"Curel Rough Skin Rescue, 13 Ounce"
B00T490H3S,"Biokleen Laundry Detergent Powder, Concentrated, Eco-Friendly, Non-Toxic, Plant-Based, No Artificial Fragrance, Colors or Preservatives, Premium Plus, 5 Pounds - 108 HE Loads/54 Standard Loads"
B00T490MQU,"Biokleen Bac-Out Fresh, Fabric Refresher, Eco-Friendly, Non-Toxic, Plant-Based, No Artificial Fragrance, Colors or Preservatives, Lavender, 16 Ounces"
B00T4GE9JO,"Dr. McDougall's Right Foods Asian Entree, Spicy Szechuan Noodle, 2-Ounce Packages (Pack of 6)"
B00T4GDX32,"Dr. McDougall's Right Foods Asian Entree, Masala Lentil Pilaf, 2.6-Ounce Packages (Pack of 6)"
B00T4GDRE2,"Dr. McDougall's Right Foods Asian Entree, Lentil Curry Pilaf, 2.5-Ounce Packages (Pack of 6)"
B00T4GE296,"Dr. McDougall's Right Foods Asian Entree, Soy Ginger Noodle, 1.9-Ounce Packages (Pack of 6)"
B00T4GFX3A,"Dr. McDougall's Right Foods Vegan Split Pea Soup, 2.5-Ounce Cups (Pack of 6)"
B00T4GFTQ6,"Dr. McDougall's Right Foods Vegan Pilaf Chicken Flavor, 2.7-Ounce Cups (Pack of 6)"
B00T4GG3BQ,"Dr. McDougall's Right Foods Vegan Spring Onion Noodle Soup, 1.9-Ounce Cups (Pack of 6)"
B00T4GFCOU,"Dr. McDougall's Right Foods Vegan Chicken Flavor Noodle Soup, Light Sodium, 1.4-Ounce Cups (Pack of 6)"
B00T4GF9XY,"Dr. McDougall's Right Foods Vegan Black Bean and Lime Soup, 3.4-Ounce Cups (Pack of 6)"
B00T4GFFMO,"Dr. McDougall's Right Foods Vegan Chinese Noodle Soup, Lower Sodium, 1.4-Ounce Cups (Pack of 6)"
B00T4GFZU6,"Dr. McDougall's Right Foods Vegan Split Pea Soup, Lower Sodium, 1.9-Ounce Cups (Pack of 6)"
B00T4GFKRY,"Dr. McDougall's Right Foods Vegan Minestrone and Pasta Soup, 2.3 Ounce Cups (Pack of 6) Non-GMO, No Added Oil, Paper Cups From Certified Sustainably-Managed Forests"
B00T4GFNWG,"Dr. McDougall's Right Foods Vegan Miso Ramen, 1.9-Ounce Cups (Pack of 6)"
B00T4GEC4G,"Dr. McDougall's Right Foods Asian Entree, Teriyaki Noodle, 1.9-Ounce Packages (Pack of 6)"
B00T4GFI9E,"Dr. McDougall's Right Foods Vegan Lentil Couscous Soup, Lower Sodium, 2.1-Ounce Cups (Pack of 6)"
B00T4GGCGW,"Dr. McDougall's Right Foods Vegan White Bean and Pasta Soup, Light Sodium, 1.8-Ounce Cups (Pack of 6)"
B00T4GG9FQ,"Dr. McDougall's Right Foods Vegan Tortilla Soup with Baked Chips, 2-Ounce Cups (Pack of 6)"
B00T4GFQSM,"Dr. McDougall's Right Foods Vegan Pad Thai Noodle Soup, Fresh Flavor, 2-Ounce Cups (Pack of 6)"
B00T4GG61I,"Dr. McDougall's Right Foods Vegan Tomato Basil Pasta Soup, Lower Sodium, 1.3-Ounce Cups (Pack of 6)"
B00T4MGCDY,"GoPicnic Gold Star Premium Ready-to-Eat Meals Edamame Kale Dip and Plantain Chips, 4.2 Ounce"
B00T4MHTN6,"GoPicnic Ready-to-Eat Meals Sunflower Butter &amp; Multigrain Crackers, 6 ounce"
B00T4MH3LO,GoPicnic Ready-To-Eat Meals Black Bean Dip and Plantain Chips 4.13 Ounce
B00T4MHKJ4,"GoPicnic Ready-to-Eat Meals Salami and Cheese, 3.6 Ounce"
B00T4MHCOC,"GoPicnic Ready-to-Eat Meals Peanut Butter and Crackers,6.14 Ounce"
B00T4MQXNS,"Campbell's Chunky Healthy Request Beef with Country Vegetables Soup, 18.8 oz. Can"
B00T4MI912,"GoPicnic Ready-to-Eat Meals Turkey Slices and Cheddar, 6 Ounce"
B00T4MI1JM,"GoPicnic Ready-to-Eat Meals Turkey Pepperoni and Cheese, 3.2 Ounce"
B00T4MQQAS,"Campbell's Chunky Hearty Cheeseburger Soup, 18.8 oz. Can"
B00T61SAQK,"OxiClean High Def Sparkling Fresh Liquid Laundry Detergent, 60 oz."
B00T61S58S,"Arm &amp; Hammer Laundry Detergent Plus OxiClean, Clean Meadow, 122.5 Oz"
B00T7ATKVE,"Trident Sugar Free Gum (Spearmint, 18-Piece, 3-Pack)"
B00T7ATYWO,"Trident Sugar Free Gum (Cinnamon, 18-Piece, 3-Pack)"
B00T7AUYA0,"Trident Layers Sugar Free Gum (Sweet Cherry &amp; Island Lime, 14 Piece, 3 Pack)"
B00T7AVENQ,"Trident Sugar Free Gum (Minty Sweet Twist, 18-Piece, 3-Pack)"
B00T7AV8NM,"Trident Sugar Free Gum (Wintergreen, 18-Piece, 3-Pack)"
B00T7AVJQ8,"Trident Layers Sugar Free Gum (Orchard Peach &amp; Ripe Mango, 14-Piece, 3-Pack)"
B00T7AV3GE,"Trident White Sugar Free Gum (Wintergreen, 16-Piece, 3-Pack)"
B00T7ATGCM,"Trident White Sugar Free Gum (Peppermint, 16-Piece, 3-Pack)"
B00T7AUIZQ,"Trident Sugar Free Gum (Mint Bliss, 18-Piece, 3-Pack)"
B00T7AUE6E,"Trident Sugar Free Gum (Perfect Peppermint, 18-Piece, 3-Pack)"
B00T7AUO28,"Trident Layers Sugar Free Gum (Grape Lemonade, 14-Piece, 3-Pack)"
B00T7KKF0E,"PROBAR Meal Bar, Superfruit Slam, 3 oz (Pack of 12)"
B00T7KLIQ4,"Probar Individual Brownie Crisp Protein Bar, 2.46 Ounce (Pack of 12)"
B00T7KL3ZA,"PROBAR BASE Protein Bar, Mint Chocolate, 2.46 oz (Pack of 12)"
B00T7PG422,"Mrs. Meyer's Clean Day Dish Soap, Bluebell, 16 fl oz"
B00T7PBUK8,"Mrs. Meyer&rsquo;s Clean Day Multi-Surface Concentrate, Basil Scent, 32 ounce bottle"
B00T7PDNWG,"Mrs. Meyer's Clean Day Liquid Hand Soap, Parsley, 12.5 Fluid Ounce"
B00TDEFAX6,"Vitafusion CoQ10 Gummy Vitamins, 200 Mg, 60ct"
B00TDEFJXC,"Vitafusion PreNatal Gummy Vitamins, 90ct"
B00TDEEHKS,"Zeasorb Antifungal Treatment Powder, Athletes Foot, 2.5 Ounce"
B00TDEG8OG,"Vega One All-in-One Nutritional Shake, French Vanilla, 15 Ounce"
B00TDEJANC,"thinkThin High Protein Bars, Chocolate Espresso, 2.1 oz Bar (10 Count)"
B00TDEJ13G,"thinkThin Brownie Crunch, Gluten Free, 2.1 Ounce (Pack of 10)"
B00TDEKEAU,"thinkThin High Protein Bars, Dark Chocolate, 2.1 Ounce (pack of 10)"
B00TDEDS7Q,"Zyrtec 24 Hour Allergy Relief Tablets, 10 mg Cetirizine HCl Antihistamine Allergy Medicine, 70 ct"
B00TDEKU04,"thinkThin High Protein Bars, Caramel Fudge, 2.1 oz Bar (10 Count)"
B00TDEJPD2,"thinkThin High Protein, Creamy Peanut Butter, 2.1 Ounce (pack of 10)"
B00TDEGG2A,"Vega One All-in-One Nutritional Shake, Vanilla Chai, 15.4 Ounce"
B00TDEHYVC,"Twinlab Niacin B-3 Capsules, 1000 mg, 120 Count"
B00TDEVSGO,"OPTIMUM NUTRITION ZMA Capsules, 180 Count"
B00TDET410,"OPTIMUM NUTRITION GOLD STANDARD 100% Casein Protein Powder, Chocolate Supreme, 2 Pound"
B00TDEV0PS,"OPTIMUM NUTRITION Fish Oil Softgels, 300 mg, 200 Count"
B00TDEVYZ4,"One-A-Day Women's Menopause Formula Multivitamin Tablets, 50 Count"
B00TDEK612,"thinkThin Protein Nut Bars, Dark Chocolate, 1.41 Ounce (pack of 10)"
B00TDEVG2K,"Optimum Nutrition Micronized Creatine Powder, Unflavored, 4.4 Pound"
B00TDEJI7A,"thinkThin High Protein Bars, Chunky Peanut Butter, 2.1 Ounce (Pack of 10)"
B00TDF0LWU,"NuGo FREE Bar, Dark Chocolate Trail Mix, 1.59 Ounce Bars (Pack of 12)"
B00TDEJY88,"thinkThin Protein Nut Bars, Chocolate Coconut Almond, 1.41 Ounce (pack of 10)"
B00TDEMB9C,"Seventh Generation Pantiliner Pads, Free &amp; Clear, 50 count"
B00TDF2EXY,"NOW Solutions Avocado Oil,4-Ounce"
B00TDES7J0,"Pedialyte Electrolyte Powder, Variety Pack, Electrolyte Hydration Drink, 0.3 oz Powder Packs, 8 Count"
B00TDF22B8,"NOW Apple Cider Vinegar 450 mg,180 Capsules"
B00TDEWCV4,"One A Day Women's Vitacraves, 150 Count"
B00TDEYCZS,"NutriGold Omega-3 Fish Oil Triple Strength Omega-3 Gold, 1250 mg Fish Oil Supplement with 1000 mg EPA+DHA Per Softgel, 180 Softgels"
B00TDF6O6M,"NOW Inositol 500 mg,100 Capsules"
B00TDETQLI,"OPTIMUM NUTRITION Oats and Whey Protein Powder, Naturally Flavored Vanilla Bean, 3 Pound"
B00TDF4C34,"NOW Cordyceps 750 mg,90 Veg Capsules"
B00TDEF2HA,"Vitafusion Fiber Well Gummy Vitamins, 90 Count (Packaging May Vary)"
B00TDEXAEM,"Nuts 'N More Peanut Butter, 16 Ounce"
B00TDEKLQM,"thinkThin High Protein &amp; Fiber Bars, Chocolate Almond Coconut, 1.76 Ounce (pack of 10)"
B00TDF3KPA,"NOW Sports Carbo Gain Powder, 8-Pound"
B00TDF9NA6,"NOW Pumpkin Seed Oil 1000 mg,100 Softgels"
B00TDF8DA2,"NOW Omega 3-6-9 1000 mg,250 Softgels"
B00TDF7VE6,"NOW Magnesium 400 mg,180 Capsules"
B00TDEM4MG,SlimFast &ndash; Original Meal Replacement Shake Mix Powder &ndash; Weight Loss Shake &ndash; 10g of Protein &ndash; 24 Vitamins and Minerals Per Serving &ndash; Great Taste &ndash; 31.18 oz. &ndash; Rich Chocolate Royale Flavor
B00TDF73NK,"NOW L-Arginine 1000 mg, 120 Tablets"
B00TDEG0M6,"Vega One All-in-One Nutritional Shake, Chocolate, 16 Ounce"
B00TDEWLDS,"Omega Nutrition Certified Organic Apple Cider Vinegar, 12 Fl Oz"
B00TDF5RKQ,"NOW Glucomannan 575 mg,180 Capsules"
B00TDF5XD2,"NOW Glucosamine &amp; Chondroitin with MSM 300 mg,180 Capsules"
B00TDFB26Y,"NOW Ubiquinol 100 mg,60 Softgels"
B00TDFBBUQ,"NOW Vitamin C-1000 Sustained Release,250 Tablets"
B00TDF3316,"NOW BerryDophilus,60 Chewables"
B00TDEL8RI,"Health Plus Super Colon Cleanse: 10-Day Cleanse -Detox |  6 Cleanses, 240 Capsules"
B00TDFB89A,"NOW Valerian Root 500 mg,250 Capsules"
B00TDFBI3Q,"NOW Vitamin D-3 5,000 IU,120 Softgels"
B00TDFBOPI,"NOW Sports Whey Protein Isolate Unflavored Powder, 1.2-Pound"
B00TDEZUC2,"NuGo All-Natural Nutrition Bar, Chocolate, 1.76 Ounce Bars (Pack of 15)"
B00TDF6TA8,"NOW Organic  Inulin Powder, 8-Ounce"
B00TDEX2VS,"Nuun All Day: Hydrating Vitamin &amp; Electrolyte Tablets, Mixed Flavors, Box of 4 Tubes (Packaging May Vary)"
B00TDF5BK2,"NOW Folic Acid 800 mcg with Vitamin B-12,250 Tablets"
B00TDFBLL0,"NOW MK-7 Vitamin K-2 100 mcg,60 Veg Capsules"
B00TDFC0NI,"NeoCell Collagen Type 2 Immucell Complete Joint Support Capsules, 2400 mg, 120 Count"
B00TDFBRRI,"NOW Zinc Picolinate,120 Veg Capsules"
B00TDFCOZW,"Nature's Way Alive Liquid, 30 Ounce"
B00TDFCBAA,"NeoCell Super Powder Collagen, Type 1 and 3, 7 Ounce"
B00TDFEBZS,"Nature's Way Rhodiola Rosea Veg Capsules, 60 Count"
B00TDFAOPE,"NOW Taurine 1000 mg,100 Veg Capsules"
B00TDEUTN2,"OPTIMUM NUTRITION ESSENTIAL AMINO ENERGY with Green Tea and Green Coffee Extract, Flavor: Watermelon, 65 Servings"
B00TDEW6BK,"One A Day Women's 50+ Advantage Multivitamins, 120 Count"
B00TDFC7T0,"NeoCell Super Collagen Type 1 and 3 6000 mg plus Vitamin C, 250 Count"
B00TDF88RU,"NOW Nutritional Yeast Flakes,10-Ounce"
B00TDFCEAC,NeilMed Sinugator Cordless Pulsating Nasal Wash with 30 Premixed Packets
B00TDFHHIG,Nature Made Prenatal + DHA 200 mg Multivitamin Softgels 90 Ct
B00TDFF5TE,"Nature's Way Vitamin C 1000 with Rose Hips, 250 Capsules"
B00TDF6YLM,"NOW Solutions Jojoba Oil,4-Ounce"
B00TDFJERS,Little Remedies Gas Relief Drops | Natural Berry Flavor | 1 oz. | Pack of 1 | Gently Works in Minutes | Safe for Newborns
B00TDFKK5I,"Jarrow Formulas Astaxanthin, Supports Eye Health, 4 mg, 60 Softgels"
B00TDFJZ68,"Lavilin Underarm Deodorant Cream, 12.5 Gram"
B00TDFIIWA,"MET-Rx Amino 3000 Tablet, 180 Count"
B00TDFK562,"Lansinoh Breastmilk Storage Bags, 100 Count, BPA Free and BPS Free"
B00TDFH0V0,Nature Made Calcium (Carbonate) 600 mg w. D3 400 IU Tablets Mega Size 220 Ct
B00TDFHWAY,"Natural Factors Vitamin C Blueberry, Raspberry, Boysenberry Chewables 500 mg Wafers, 180 Count"
B00TDFHKFQ,Nature Made Vitamin B12 1000 mcg. Timed Release Tablets Value Size 160 Ct
B00TDFK26A,"Lansinoh Lanolin Nipple Cream, 100% Natural Lanolin Cream for Breastfeeding, 1.4 oz Tube"
B00TDFHQIW,"Nature Made Vitamin D3 1000 IU Softgels, 100 Ct"
B00TDFM90C,"Jarrow Formulas MSM Sulfur, Strengthens Joints, 1000 mg, 200 Capsules"
B00TDFLFDE,"Jarrow Formulas Glucosamine and Chondroitin and MSM Caps, Supports Joint Health, 240 Caps"
B00TDFLMW8,"Jarrow Formulas L-Arginine Tabs, Supports Cardiovascular Health, 1000 mg, 100 Count"
B00TDFIOPG,"MET-Rx Big 100 Colossal Peanut Butter Pretzel, 3.52 Ounce Bars, 4 Count"
B00TDFM3NU,"Jarrow Formulas Methyl-B12 Lozenges, Supports Brain Cells and Nerve Tissue, Lemon, 1000 mcg, 100 Lozenges"
B00TDFN5K0,"Jarrow Formulas Whey Protein, Supports Muscle Development, French Vanilla, 2 Pound"
B00TDFHNNU,Nature Made Vitamin D3 5000 IU Ultra Strength Softgels 90 Ct
B00TDFNFS2,"Systane ICaps Eye Vitamin &amp; Mineral Supplement, Lutein &amp; Zeaxanthin Formula, 120 Coated Tablets"
B00TDFMX1W,"Jarrow Formulas SAM-e, Promotes Joint Strength, Liver Detoxification, 400 mg, 30 Enteric-Coated Tabs"
B00TDFO5RC,"GoodSense All Day Allergy, Cetirizine HCL Tablets, 10 mg, 365 Count"
B00TDFOSPG,Enfamil D-Vi-Sol Vitamin D Supplement Drops for Infants 50 mL dropper bottle
B00TDFMMTU,"Jarrow Formulas Q-Absorb Co-Q10, Supports Heart Function, 100 mg, 120 Softgels"
B00TDFMU2Y,"Jarrow Formulas SAM-e, Promotes Joint Strength, Liver Detoxification, 200 mg, 60 Enteric-Coated Tabs"
B00TDFP8TG,"Emergen-C (30 Count, Tangerine Flavor, 1 Month Supply) Dietary Supplement Fizzy Drink Mix with 1000mg Vitamin C, 0.33 Ounce Packets, Caffeine Free"
B00TDFLY9Y,"Jarrow Formulas Mastic Gum, Supports the Stomach and Duodenal Health, 60 Tablets"
B00TDFOI4M,"Ester-C Vitamin C, 1,000 mg, 120 Coated Tablets"
B00TDFQFLQ,"Desitin Rapid Relief Diaper Rash Remedy, Fragrance-Free Cream, 16 Oz."
B00TDF9JOG,"NOW  Psyllium Husk Powder,24-Ounce"
B00TDFPATE,"Emergen-C Dietary Supplement with 1000mg Vitamin C Variety Pack (Raspberry, Tangerine, Super Orange Flavors, 30-Count 0.32 oz. Packets)"
B00TDFLVDS,"Jarrow Formulas Magmind Nutritional Supplement, Supports Cognition and Brain Health, 90 Count"
B00TDFE5NG,"Nature's Way MSM Tablets, 1000 mg, 200 Count"
B00TDFRHN6,"BSN SYNTHA-6 Protein Powder, Strawberry Milkshake, 5.0 Pound"
B00TDFQL42,"Muscle Milk Naturals Protein Powder, Natural Real Chocolate, 32g Protein, 2.47 Pound"
