asin,title
B010DRZ5HW,"Oxford Blank Index Cards, 4&quot; x 6&quot;, White, 100 Cards per Pack (40)"
B010DRZHZ2,"Pendaflex Essentials Hanging Folders, Letter Size, Assorted Colors, 25 per Box (75708)"
B010DRZRP2,"Pendaflex Essentials  Recycled Hanging Folders, Letter Size, Standard Green, 25 per Box (75705)"
B010DS1YL2,"Prang Hygieia Chalk, 3.25 x 0.375 Inch Sticks, White, 12 Pieces (31144)"
B010DS3GFO,"BIC Velocity Bold Ball Pen, 1.6mm, Black, 12 Count (VLGB11-Blk)"
B010DS3O06,"BIC Brite Liner Highlighter, Chisel Tip, Assorted Colors, 5-Count"
B010DS7CFO,"Avery Mini Heavyweight Sheet Protectors, 5.5&quot; x 8.5&quot;, Pack of 25 (77004)"
B010DS8X5W,"Avery Self-Adhesive Polyvinyl Standard Diameter Hole Reinforcements, White, 1,000 per Pack (5720)"
B010DRXU7O,"Pendaflex File Folders with InfoPocket, Letter Size, 1/3 Cut, Assorted Colors, 30 Folders per Pack (02086)"
B010DSA9D6,"Avery Carter's Felt Stamp Pad, Black, 3.25&quot; x 6.25&quot; (21082)"
B010DSB72S,"Stanley Bostitch Professional Magnetic Easy Staple Remover, Black (40000M-BLK)"
B010DSC006,"Bostitch Twist-N-Sharp Pencil Sharpener, Assorted Colors (PS1-ADJ)"
B010DS6UF2,"Avery Self-Adhesive Laminating Sheets, 9&quot; x 12&quot;, Box of 50 (73601)"
B010DS82SU,"Avery Economy Clear Sheet Protectors, Acid Free, Box of 50 (74090)"
B010DS6M1O,"Avery Two-Pocket Folders, Assorted Colors, Box of 25 (47993)"
B010DS00Y4,"Oxford Ruled Index Cards, 3&quot; x 5&quot;, White, 100 Cards per Pack (31)"
B010DS45ZE,"BIC Xtra-Precision Mechanical Pencil, Metallic Barrel, Fine Point (0.5mm), 24-Count"
B010DS301E,"BIC 4-Color Ball Pen, Medium Point (1.0mm), Assorted Ink, 3-Count"
B010DSAPE4,"Avery 8-Tab Plastic Binder Dividers with Pockets, Insertable Multicolor Big Tabs, 1 Set (11907)"
B010DS9ZLS,"Avery Removable Labels, Rectangular, 1&quot; x 3&quot;, White, Pack of 72 (06728)"
B010DS4LNU,BAZIC 12&quot; (30cm) Jeweltones Color Ruler (4/Pack)
B010E1XTKM,"Jarrow Formulas Hyaluronic Acid, Skin Hydration, 50 mg, 120 Veggie Caps"
B010E1XZYC,"Jarrow Formulas Selenium Synergy Caps, Supports Vision, Cardiovascular Health, 60 Count"
B010E1WRUU,"Jarrow Formulas Biotin, Supports Energy Production and Hair and Nails, 5000 mcg, 100 Capsules"
B010E6P0DQ,"Jarrow Formulas Coconut Oil 100% Organic, Extra Virgin, 16 Ounce"
B010E6PVSA,"Jarrow Formulas Milk Thistle Standardized Silymarin Extract 30:1 Ratio Veggie Caps, Supports Liver Function, 150 mg, 200 Capsules"
B010E6POLO,"Jarrow Formulas B-Right Complex, Supports Brain, Memory, Energy, Cardiovascular Health, 100 Capsules"
B010E6R976,"Jarrow Formulas Zinc Balance Caps, Supports Immune and Antioxidant Protection, 15 mg, 100 Capsules"
B010E6RMLY,"Jarrow Formulas Milk Thistle Silymarin Extract 30:1 Ratio, Supports Liver Function, 150 mg, 100 Veggie Caps"
B010E6PZS6,"Jarrow Formulas QH-Absorb Softgel, High Absorption/Enhanced Stability, 1000 mg, 60 Count"
B010E6QKAS,"Jarrow Formulas Bone-Up-Three Per Day Caps, Promotes Bone Density, 90 Count"
B010E6TADW,"Jarrow Formulas Acetyl L-Carnitine Caps, Antioxidant Protection for the Brain, 500 mg, 60 Count"
B010E6SL6O,"Jarrow Formulas L-Tyrosine Caps, Supports Synthesis of Brain Neurotransmitters, 500 mg, 100 Count"
B010E6SVPA,"Jarrow Formulas Natural Whey Protein, Supports Muscle Development, Chocolate, 32 OZ"
B010E6QGA2,"Jarrow Formulas L-Lysine Caps, Essential Amino Acid for Protein Metabolism, 100 Count,"
B010E6T3T8,"Jarrow Formulas 5-HTP Caps, Brain and Memory Support, 50 mg, 90 Capsules"
B010FATC5I,"Advil Liqui-Gels (50 Packets of 2 Capsules) Pain Reliever/Fever Reducer Liquid Filled Capsule, 200mg Ibuprofen, Temporary Pain Relief, Travel Pack"
B010FAU07W,"Caltrate Gummy Bites (Black Cherry, Strawberry, Orange Flavors, 50 Count) Calcium and Vitamin D3 Supplement, 500 mg"
B010FASUO2,"Caltrate Gummy Bites (Black Cherry, Strawberry, Orange Flavors, 100 Count) Calcium and Vitamin D3 Supplement, 500 mg"
B010FAWMJ6,"Advil PM (40 Count) Pain Reliever/Nighttime Sleep Aid Coated Caplet, 200mg Ibuprofen, 38mg Diphenhydramine"
B010FAUO8C,"Centrum Women (200 Count) Multivitamin / Multimineral Supplement Tablet, Vitamin D3"
B010FAV2V0,"Centrum Silver Men (200 Count) Multivitamin / Multimineral Supplement Tablet, Vitamin D3, Age 50+"
B010FAY9I8,"Centrum Kids Flavor Burst (120 Count, Grape and Blue Raspberry Flavor) Multivitamin / Multimineral Supplement Chews, Vitamin A, Vitamin C, Vitamin D"
B010FAXDH6,"Preparation H (2 x 48 Count, 96 Count) Flushable Medicated Hemorrhoid Wipes, Maximum Strength Relief with Witch Hazel and Aloe, Pouch"
B010FB0Q1Q,"Centrum Women (120 Count) Multivitamin / Multimineral Supplement Tablet, Vitamin D3"
B010FB1ZC0,"Advil (200 Count) Pain Reliever / Fever Reducer Coated Gel Caplet, 200mg Ibuprofen, Temporary Pain Relief"
B010FAXTUW,Robitussin Peak Cold CF Multi-Symptom Cold Relief (8 fl. oz. Bottle)
B010FB09H2,"Emergen-C Immune+ (30 Count, Raspberry Flavor) System Support Dietary Supplement Fizzy Drink Mix With Vitamin D, 1000mg Vitamin C plus Antioxidants &amp; Electrolytes, 0.32 Ounce Packets"
B010FAYY4M,"Caltrate 600+D3 Plus Minerals  (Cherry, Orange, and Fruit Punch, 155 Count) Calcium &amp; Vitamin D3 Chewable Supplement, 600mg"
B010FAU8MO,"Advil Liqui-Gels (200 Count) Pain Reliever/Fever Reducer Liquid Filled Capsule, 200mg Ibuprofen, Temporary Pain Relief"
B010FAVAQM,Robitussin Peak Cold DM Non-Drowsy Cough &amp; Chest Congestion Relief (12 fl. oz. Bottle)
B010FAZ5BS,"Advil Junior Strength Fever Reducer/Pain Reliever, 100mg Ibuprofen (24-Count Coated Tablets)"
B010FB0XPK,"Centrum Men (120 Count) Multivitamin / Multimineral Supplement Tablet, Vitamin D3"
B010FAXLX2,Robitussin Peak Cold DM Non-Drowsy Cough &amp; Chest Congestion Relief (8 fl. oz. Bottle)
B010FAZSR4,"Centrum Silver Adult (220 Count) Multivitamin / Multimineral Supplement Tablet, Vitamin D3, Age 50+"
B010FAZDNI,"Advil Infants' Fever Reducer/Pain Reliever Dye-Free, 50mg Ibuprofen Concentrated Drops (White Grape Flavor, 0.5 fl. oz. Bottle, Pack of 2)"
B010FATSK2,"Alavert Allergy 24-Hour Relief (18 Count Citrust Burst Flavor Orally Disintegrating Tablets), Non-Drowsy, Antihistamine"
B010FB6TJO,"Advil Children's Fever Reducer/Pain Reliever Dye-Free, 100mg Ibuprofen (White Grape Flavor Oral Suspension, 4 fl. oz. Bottle)"
B010FB3BE0,ThermaCare Knee &amp; Elbow Pain Therapy Heatwraps (2-Count)
B010FB27NG,"Caltrate 600+D3 (60 Count) Calcium and Vitamin D Supplement Tablet, 600 mg"
B010FB2MX6,Anbesol Maximum Strength Oral Anesthetic Gel (0.33 Ounce Tube)
B010FB5VKM,"Caltrate 600+D3 Soft Chews (Chocolate Truffle, 60 Count) Calcium and Vitamin D3 Chewable Supplement, 600mg"
B010FB84QA,ChapStick Dual-Ended Hydration Lock Moisturize and Renew (0.154 oz. Stick)
B010FB9SLK,"Advil (20 Count) Pain Reliever/Fever Reducer Film Coated Caplet, 200mg Ibuprofen, Rapid Release Formula, Temporary Pain Relief"
B010FB0IC8,"Emergen-C Immune+ (30 Count, Super Orange Flavor) System Support Dietary Supplement Fizzy Drink Mix With Vitamin D, 1000mg Vitamin C plus Antioxidants &amp; Electrolytes, 0.33 Ounce Packets"
B010FB1IJ0,"Children&rsquo;s Dimetapp Cold &amp; Cough &amp; Children&rsquo;s Dimetapp Nighttime Cold &amp; Congestion (4 fl. oz., Pack of 2, Grape Flavor), Decongestant, Antihistamine &amp; Cough Suppressant, Ages 6+"
B010FAWDSQ,"Centrum Specialist Heart Adult (60 Count) Multivitamin / Multimineral Supplement Tablet, Vitamin D3, C, B-Vitamins with Phytosterols"
B010FBABXO,"Emergen-C Immune+ (10 Count, Raspberry Flavor) System Support Dietary Supplement Fizzy Drink Mix With Vitamin D, 1000mg Vitamin C plus Antioxidants &amp; Electrolytes, 0.32 Ounce Packets"
B010FBC2TU,"Centrum Kids Chewables (80 Count, Cherry, Orange, &amp; Fruit Punch Flavor) Multivitamin / Multimineral Supplement Tablet, Vitamin A, Vitamin C, Vitamin E"
B010FB4K8G,"ThermaCare Advanced Multi-Purpose Joint Pain Therapy (4 Count) Heatwraps, Up to 8 Hours of Pain Relief, Temporary Relief of Joint Pains"
B010FB632W,"Caltrate 600+D3 Soft Chews (Vanilla Cr&egrave;me, 60 Count) Calcium and Vitamin D3 Chewable Supplement, 600mg"
B010FB2WGS,"Advil (24 Count) Pain Reliever/Fever Reducer Coated Tablet, 200mg Ibuprofen, Temporary Pain Relief"
B010FB8C3A,"Children&rsquo;s Robitussin Cough Long-Acting (4 fl. oz, Fruit Punch Flavor), 8-Hour Cough Suppressant, Alcohol-Free, Ages 4+"
B010FB9XZ6,"Centrum Liquid Adults (8 Fl. Oz. Bottle, Orange Tangerine Flavor) Multivitamin and Multimineral Supplement"
B010FB7FII,"Advil (200 Count) Pain Reliever/Fever Reducer Coated Caplet, 200mg Ibuprofen, Temporary Pain Relief"
B010FB5FD0,"Caltrate 600+D3 Plus Minerals (60 Count) Calcium &amp; Vitamin D3 Supplement Tablet, 600 mg"
B010FBA53U,"Emergen-C Immune+ (10 Count, Blueberry-Acai  Flavor) System Support Dietary Supplement Fizzy Drink Mix With Vitamin D, 1000mg Vitamin C plus Antioxidants &amp; Electrolytes, 0.31 Ounce Packets"
B010FB96Q2,"Preparation H (1.8 Ounce, 1 Tube per Box) Hemorrhoid Symptom Treatment Cream, Maximum Strength Pain Relief with Aloe, Tube"
B010FB33KC,"Centrum Adult Flavor Burst (120 Count, Mixed Fruit Flavor) Multivitamin/Multimineral Supplement Chews, Vitamin A, Vitamin C, Vitamin D"
B010FBAINW,"Emergen-C Immune+ Warmers (10 Count, Apple Cider Flavor) Dietary Supplement Flavored Hot Drink Mix, 1000mg Vitamin C, 0.33 Ounce Packets"
B010FB1BJC,"Centrum Silver Women (100 Count) Multivitamin / Multimineral Supplement Tablet, Vitamin D3, Age 50+"
B010FCWG3G,"ICE BREAKERS COOL BLASTS Chews (Spearmint, 0.8-Ounce, Pack of 6)"
B010FM0EFI,"Pringles Tortilla Zesty Salsa, 6.4 Ounce"
B010FOD4W6,"Keebler&nbsp;Soft Batch Cookies, Chocolate Chip, 15 oz&nbsp;Tray"
B010HKIYFK,"KISSES Holiday Milk Chocolates Filled with Cherry Cordial Cr&egrave;me, 10 Ounce"
B010HKJBKW,"HERSHEY'S Holiday Chocolate Candy Dish Assortment, 21 Ounce"
B010HKICQG,"HERSHEY'S KISSES Chocolate Candy, Giant Kiss, 7 Ounce"
B010HKK890,"REESE'S Holiday Peanut Butter Cups Miniatures, 36 Ounce"
B010HKJ7AQ,"KIT KAT Holiday Miniatures, 10 Ounce"
B010HKIP4K,"KISSES Holiday Milk Chocolates, 36 Ounce"
B010HKIGVC,"YORK Holiday Peppermint Patties, 18.5 Ounce"
B010HKJJN6,"HERSHEY'S Chocolate Candy Bar, 5 Pound"
B010HKKKVG,"Campbell's SpaghettiOs Canned Pasta, Meatballs, 22.2 oz Can"
B010HKJ2X8,"KISSES Holiday Candy Cane Mint Candies, 33 Ounce"
B010HKJXR8,"ROLO Holiday Chewy Caramels in Milk Chocolate, 36 Ounce"
B010LEDAV0,"Great Northern Popcorn Company Polar Cones and Shaved Ice Syrup, 80 Ounce"
B010LEDNVW,"Great Northern Popcorn Company Pint Popcorn Oil, 1 Pound"
B010LED060,Great Northern Popcorn Company Flufftastic 3 Flavor Party Pack Premium Cotton Candy Floss Pint with 50 Cones
B010LEE9YW,"Kauai Coffee, Na Pali Coast Dark Roast, Single Serve Coffee Cups, 12 Count"
B010LEEDE8,"Hills Bros Cappuccino, English Toffee, 16 Ounce"
B010LEEH3U,"Hills Bros Cappuccino, Sugar-Free French Vanilla, 12 Ounce"
B010LEDYPW,"French Market Coffee &amp; Chicory, Medium-Dark Roast, 12 oz Can"
B010LEG9HW,"Planters Deluxe Mixed Nuts, Lightly Salted, 15.25 Ounce Canister"
B010LEE2SK,"French Market Coffee &amp; Chicory, Dark Roast, 12 Ounce Can"
B010LEEKNC,"Peeled Snacks Organic Dried Fruit, Much-Ado-About-Mango, 1.4 Ounce (Pack of 10)"
B010LECQDS,"Great Northern Popcorn Premium Portion Packs, 10.75 Ounce"
B010LEDGV4,"Great Northern Popcorn Company Polar Cones and Shaved Ice Syrup, 48 Ounce"
B010LEFD9M,"Eight O'Clock Ground Coffee, The Original, 36 Ounce"
B010LED3OE,"Great Northern Popcorn Company Flufftastic Quart Cotton Candy Floss, 3 Count"
B010LEG29M,"Two Rivers Coffee, Tea, Cocoa, Cider, Cappuccino Single-cup Sampler Pack for Keurig K-Cup Brewers, 40 Count"
B010LEEPGO,"Honey Stinger Organic Waffle, Honey, Sports Nutrition, 1.06 Ounce (16 Count)"
B010LEFGTY,"Eight O'Clock Whole Bean Coffee, Hazelnut, 33 Ounce"
B010LEFKKO,"Eight O'Clock Whole Bean Coffee, 100% Colombian Peaks, 40 Ounce"
B010LEIU4W,"Horizon Organic Classic Mac Cheese, Microwaveable Macaroni and Mild Cheddar, 2 Count (Pack of 6)"
B010LEIQA0,"Horizon Organic Mac Cheese, Macaroni and White Cheddar, 6 Ounce (Pack of 12)"
B010LEIY7K,"Silk Very Vanilla Soymilk Natural 8 Ounce (Pack of 18), Vanilla Flavored Non-Dairy Soy Milk, Individually Packaged, Dairy-free Milk"
B010LEMWAA,Betty Crocker Gluten Free non-GMO Cookie Mix Chocolate Chip 19.0 oz Box (Pack of 6)
B010LEF4MI,"White House Coffee Kahlua Gourmet Ground Coffee, Original, 12 Ounce"
B010LEJ2GW,"Amazing Grass Green SuperFood Alkalize and Detox, 8.5 Ounce"
B010LEJXMK,"Authentic Foods Tapioca Flour, 2.5 Pound"
B010LEFT1Y,"Eight O'Clock Ground Coffee, 100% Colombian Peaks, 33 Ounce"
B010LENC5Y,"Ahmad Tea Twelve Teas, 60 Count"
B010LEKQMQ,"Simply Organic Ground Cinnamon, 2.45 Ounce"
B010LEKMMK,"Simply Organic White Onion Powder, 3 Ounce"
B010LEO8AW,"Maple Almond Butter Squeeze Packs by Justin's, Gluten-free, Non-GMO, Responsibly Sourced, Pack of 10 (1.15oz each)"
B010LELDAK,"Kraft Shake N Bake BBQ Glaze Seasoned Coating Mix, 6 Ounce"
B010LEO2EY,"Honey Tree Raw Organic Honey, Wildflower, 12 Ounce"
B010LEEU46,"Yogi Tea, Honey Lavender Stress Relief, 16 Count, Packaging May Vary"
B010LEN7UE,"Anderson's Dark Amber Maple Syrup, Grade A, 32 Ounce"
B010NBDK5W,"Great Northern Popcorn Organic Yellow Gourmet Popcorn 5 Pound, 2 Pack"
B010NBFQ04,"Lavazza L'Espresso Gran Crema Whole Bean Coffee Blend, Medium Espresso Roast, 2.2-Pound Bag"
B010NBG3X8,"Knox Gelatin, Unflavored, 32 Individual Packets"
B010NBHWSS,"San Francisco Bay OneCup, Organic Rainforest Blend, 36 Count- Single Serve Coffee, Compatible with Keurig K-cup Brewers"
B010NBGP0Y,"Planters Mixed Nuts, Salted, 56 Ounce Canister"
B010NBGXS8,"Nutiva Organic Hemp Protein, Hi-Fiber, 3 Pound"
B010NBIT6W,"Grove Square Cappuccino, Hazelnut, 24 count"
B010NBIPO8,"Grove Square Cappuccino, French Vanilla, 24 count"
B010NBIWRI,"Grove Square Hot Cocoa, Milk Chocolate, 24 count"
B010NBJ4XO,"Caza Trail Coffee, Kona Blend, 100 count"
B010NBGC3Y,"Maxwell House International Coffee Decaf Sugar Free Suisse Mocha Cafe, 4 Ounce"
B010NBJ17I,"Grove Square Hot Cocoa, Irresistible Flavors Variety Pack, 24 count"
B010NBHE7C,"Yogi Tea, Ginger, 16 Count, Packaging May Vary"
B010NBK4L0,"HERSHEY'S Chocolate Candy Bar Assortment, Miniatures (HERSHEY'S, KRACKEL, MR. GOODBAR, SPECIAL DARK), 40 Ounce Bulk Candy"
B010NBK8HA,"HERSHEY'S KISSES Chocolate Candy, 40 Ounce Bulk Candy"
B010NBKFPK,HERSHEY'S Nuggets Chocolates Assortment (38.5-Ounce Party Bag)
B010NBILJ2,"Roland Quinoa, White, 12 Ounce"
B010NBHIDC,"Yogi Tea, Egyptian Licorice, 16 Count, Packaging May Vary"
B010NBJP0Q,"Stash Tea Jasmine Blossom Green Tea, 100 Count (packaging may vary)"
B010NBHROW,"San Francisco Bay OneCup, French Roast, 36 Count- Single Serve Coffee, Compatible with Keurig K-cup Brewers"
B010NBFHFS,"Nestle Candy Chocolate Assorted Miniatures Bag, 40 Ounce"
B010NBKWVM,"HERSHEY'S Holiday Stocking Stuffer Shapes Chocolate Assortment, 23.1 Ounce"
B010NBH38M,"Yogi Tea, Cinnamon Vanilla Healthy Skin, 16 Count, Packaging May Vary"
B010NBLL3U,"International Delight, French Vanilla Liquid Creamer, 192-Count Single-Serve Packages, Individual French Vanilla Flavored Coffee Creamer"
B010NBJWMW,"Stash Tea Double Bergamot Earl Grey Tea, 100 Count (packaging may vary)"
B010NBH7S8,"Yogi Tea, DeTox, 16 Count, Packaging May Vary"
B010NBOZOW,"Peet's Coffee Major Dickason's Blend, Dark Roast, 12 oz., Rich, Smooth, and Complex Dark Roast Coffee Blend, with A Full Bodied and Layered Flavor"
B010NBKSHK,"YORK Dark Chocolate Peppermint Patties, Peppermint Candy, 40 Ounce Bulk Candy"
B010NBMF8U,"Baby's Only Organic Non-GMO Soy Toddler Formula, 12.7 oz"
B010NBIA3O,"San Francisco Bay Coffee, Breakfast Blend, 72 Count"
B010NBQ4HI,"Lindt Chocolate Lindor Truffles, White Chocolate, 60 Count"
B010NBMB7A,"Jack Links Jerky, Original, 16 Ounce"
B010NBPSGG,"Lindt Chocolate Lindor Truffles, Milk Chocolate, 60 Count"
B010NBOJG6,"Custom Variety Pack Decaf Coffee for Keurig K-Cup Brewers, 30 Count"
B010NBN1TM,"Bob's Red Mill Super Fine Almond Flour, 16 Ounce"
B010NBR3A0,"Krusteaz Light and Fluffy Apple Cinnamon Complete Pancake Mix, 28 Ounce"
B010NBPJGU,"Larabar Gluten Free Bars, Coconut Cream Pie, 1.7 oz Bars (16 Count)"
B010NBN6YC,"Navitas Organics Goji Berries, 8 oz. Bag &mdash; Organic, Non-GMO, Sun-Dried, Sulfite-Free"
B010NBOUGK,"Custom Variety Pack Bold Coffee for Keurig K-Cup Brewers, 30 Count"
B010NBM2RO,"Happy Baby Organic Probiotic Baby Cereal with Choline Multi-Grain, 7 Ounce Canister Organic Baby Cereal with Iron &amp; Choline to Support Baby's Brain Development, a Great First Food"
B010NBP5IM,"Celtic Sea Salt Bag, Light Grey, 5 Pound"
B010NBIHS2,"San Francisco Bay Coffee, Organic Rainforest Blend, 72 Count"
B010NBIDYK,"San Francisco Bay Coffee, Fog Chaser, 72 Count"
B010NBI0Q6,"San Francisco Bay Coffee, French Roast, 80 Count"
B010NBSNJU,"Betty Crocker Frosting, Whipped Gluten Free Frosting, Whipped Cream, 12 Oz Canister"
B010NBQEV4,"Lindt Chocolate Lindor Truffles, Caramel Milk Chocolate, 60 Count"
B010NBOPDS,"Custom Variety Pack Coffee for Keurig K-Cup Brewers, 40 Count"
B010NBQL3K,"Lindt Lindor Truffles, Milk Chocolate, 120 Count"
B010NBRJAY,"Bob's Red Mill Apple Blueberry Granola, 12 Ounce (Package May Vary)"
B010NBRXZA,"Bob's Red Mill Organic Oat Bran Hot Cereal, 18 Ounce"
B010NBRTMW,"Bob's Red Mill Gluten Free Extra Thick Rolled Oats, 32 Ounce"
B010NBS82M,"Betty Crocker Baking Warm Delights, Molten Chocolate Cake, 3.35 Ounce"
B010NBTDKI,"Senseo Coffee Pods, Colombia Blend, 16 Count"
B010NBO8SU,"Amazing Grass Green SuperFood Berry, 8.5 Ounce"
B010NBM71A,"Jack Links Jerky, Peppered, 16 Ounce"
B010NBRP7Q,"Bob's Red Mill Granola, Honey Almond, 18 Ounce"
B010NBJKNI,"Stash Tea Premium Green Tea, 100 Count (packaging may vary)"
B010NBNZQG,"Amazing Grass Green SuperFood Original, 8.5 Ounce"
B010NBR8UA,"Emerald Tropical Blend Premium Trail Mix, 6 Ounce"
B010NBKC4O,"REESE'S Peanut Butter Cups, Chocolate Candy, Miniatures, 40 Ounce Bulk Candy"
B010NBLSYC,"Happy Baby Organic Probiotic Baby Cereal Oatmeal with Iron Probiotics Choline, 7 Ounce Canister Organic Baby Cereal with Iron &amp; Choline to Support Baby's Brain Development, a Great First Food"
B010NBPESI,"Larabar Gluten Free Bar, Cherry Pie, 1.7 oz Bars (16 Count)"
B010NBRELI,"Bob's Red Mill Organic 7 Grain Pancake and Waffle, Whole Grain Mix, 26 Ounce"
B010NE4I00,"Special K Chewy Nut Bar, Dark Chocolate and Nuts, 5.82 Ounce"
B010NE507A,"Kellogg's Frosted Flakes with Energy Clusters, 12.1 Ounce"
B010NE4RGK,"Kellogg's Nutri-Grain Breakfast Biscuits (Apple Cinnamon, 7 oz)"
B010NE52LY,"Keebler, Town House Focaccia, Crackers, Rosemary and Olive Oil, 9 oz"
B010NE4Y9A,"Kellogg's Origins Ancient Grains, Touch of Honey, 11.8 Ounce"
B010NE5SBS,"Kellogg's Origins Fruit and Nut Blend, Cranberry Walnut, 12.9 Ounce"
B010NE5ZMK,"Kellogg's Origins Ancient Grains Granola, Cranberry Almond with Pumpkin Seeds, 12.5 Ounce"
B010NE4W7O,"Keebler Toast and Peanut Butter Sandwich Crackers, Value Pack, Single Serve, 1.38 oz Packages&nbsp;(27 Count)"
B010NE6682,"Kellogg's Nutri-Grain Breakfast Biscuits (Chocolate Chip, 7 oz)"
B010NE55IY,"Kashi, &nbsp;Breakfast Cereal, Organic Sprouted Grains,&nbsp;Vegan, Non-GMO Project Verified, 9.5 oz"
B010NE61XM,"Keebler Cheese and Peanut Butter Sandwich Crackers, Value Pack, Single Serve, 1.38 oz Packages&nbsp;(27 Count)"
B010NE5GY2,"Kellogg's Origins Fruit and Seed Muesli Raisin, Apricot Cranberry, 14.10 Ounce"
B010NE4U08,"Keebler&nbsp;Fudge Shoppe Cookies, Fudge, Jif Peanut Butter and Crunchy Nuts, 8 oz Tray"
B010NE5EW6,"Keebler, Town House Focaccia, Crackers, Tuscan Cheese, 9 oz"
B010NE68P8,"Special K Cranberry Granola, 10.6 Ounce"
B010NPG1BS,KIWI Shine Sponge
B010NPEM5U,"Glade Wax Melt Air Freshener Refill, Red Honeysuckle Nectar, 6 Count"
B010NPE4OY,"Glade Wax Melts Air Freshener Refill, Lavender &amp; Peach Blossom, 6 refills, 2.3 oz"
B010NPFWOK,KIWI Sport Shoe Whitener 4.0 FL. OZ.
B010NPGAXW,"Kiwi Scuff Remover, 3.5 Fluid Ounce"
B010NPEG8S,"Glade Wax Melt Refill, Lavender and Vanilla, 6 Count"
B010NPG5SM,Kiwi Express Clean and Shine Wipes 15 ct
B010NPERJQ,"Glade Wax Melts Air Freshener Refill, Radiant Berries, 6ct"
B010O757HY,"Seagrams Ginger Ale Soda Soft Drinks Fridge Pack Cans, 12 fl oz, 12 Pack"
B010O74RFC,"Coca-Cola Zero Cherry Diet Soda Soft Drink, 12 fl oz, 12 Pack"
B010O74CHA,"Diet Coke Caffeine Free Soda Soft Drink, 12 fl oz, 12 Pack"
B010O74ZJ0,"Mello Yello, 12 fl oz 12 count"
B010PPOTMY,"Just For Men Mustache and Beard Brush-In Color Gel, Real Black (Packaging May Vary)"
B010PPOMSK,"Just For Men Mustache and Beard Brush-In Color Gel, Medium Dark Brown"
B010Q32SLY,"C2O Pure Coconut Water, With Pulp, 17.5 Ounce (Pack of 12)"
B010Q33DUY,"Zipfizz Healthy Energy Drink Mix, Fruit Punch, 20 Count"
B010Q32WWY,"Crispy Green Natural, Single Serve, Freeze-Dried Fruits, Fruit Variety Pack, 0.35 Ounce (16 Count) | Non-GMO |Gluten Free |No Sugar Added"
B010Q3474U,"C2O Pure Coconut Water, 17.5 Fluid Ounce (Pack of 12)"
B010Q33X86,"Zipfizz Healthy Energy Drink Mix, Grape, 20 Count"
B010Q33ONU,"Lowrey's Bacon Curls Microwave Pork Rinds (Chicharrones), Original, 1.75 Ounce (Pack of 18)"
B010Q39FDI,"Natierra, Nature's All Foods Freeze-Dried Blueberries, 1.2 Ounce"
B010Q33138,"gimMe Snacks Organic Premium Roasted Seaweed, Sea Salt, Gluten-Free &amp; Non-GMO,  0.17 Ounce (5 g) - (Pack of 12)"
B010Q34CAE,"Oberto All Natural Applewood Smoked Bacon Jerky, 2.5-Ounce Bag"
B010Q32NL4,"Lowrey's Bacon Curls Microwave Pork Rinds (Chicharrones), Hot &amp; Spicy, 1.75 Ounce (Pack of 18)"
B010RRSZ8Y,Nature Made Multi Complete Softgels (23 Key Nutrients) 60 Ct
B010RRWXSC,Nature Made Vitamin B12 500 mcg. Tablets 100 Ct
B010RRXJXK,"Nature Made B Complex (Thiamin, Riboflavin, Niacin, B5 &amp; B6) w. Vitamin C Caplets 100 Ct"
B010RS161Q,Nature Made High Potency Magnesium 400 Mg One per Day Softgels 60 Ct
B010RS1NBE,"Nature Made Triple Omega 3-6-9 Softgels w. Fish, Flaxseed, Safflower &amp; Olive Oils Value Size 150 Ct"
B010RS21G0,"Nature Made Fish Oil Value Size Softgels, 1000 mg, 200 Count"
B010RS1YVI,Nature Made Fish Oil 1000 mg w. Omega-3 300 mg Softgels Mega Size 250 Ct
B010RS069O,Nature Made Multi For Him 50+ Tablets w. D3 - 22 Essential Vitamins &amp; Minerals 90 Ct
B010RS2QT2,Nature Made Max Strength: Biotin (B7) 5000 mcg. Softgels 50 Ct
B010RS3LZ0,Nature Made Vitamin B12 1000 mcg. Softgels 90 Ct
B010RRXZZM,Nature Made TripleFlex Triple Strength 50+ Caplet (Glucosamine Chondroitin MSM) Value Size 120 ct
B010RS1QO8,Nature Made Iron 65 mg. (from Ferrous Sulfate) Tablets 180 Ct
B010RS31WS,Nature Made Sublingual Vitamin B12 3000 mcg. Cherry Flavored Lozenges 40 Ct
B010RS23WM,Nature Made One per Day Burpless Fish Oil 1200 mg w. Omega-3 720 mg Softgels 120 Ct
B010RS2UNO,Nature Made Sublingual Vitamin B12 1000 mcg. Cherry Flavored Lozenges 50 Ct
B010RS2E6C,Nature Made CoQ10 (Coenzyme Q 10) 200 mg. Softgels 80 Count
B010RS1AW6,"Nature Made Vitamin D3 2000 IU Softgels, 90 Ct"
B010RS4TI8,Nature Made Fish Oil 1200 mg. w. Omega-3 360 mg  &amp; Lemon Essence Softgels 60 Ct
B010RS36CI,Nature Made Vitamin B12 3000 mcg. Softgels 60 Ct
B010RS2YNA,Nature Made Vitamin B12 2500 mcg. Tablets 60 Ct
B010RS6EOK,Nature Made Vitamin D3 5000 IU Ultra Strength Softgels Value Size 180 Ct
B010RS2JYE,Nature Made Magnesium 250 mg Softgels 90 Ct
B010RS728M,Nature Made Flaxseed Oil 1400 mg Softgels - Made w. Organic Flaxseed Oil 100 Ct
B010RS2B7Y,"Nature Made Vitamin D3 1000 IU Softgels, 180 Ct"
B010RS7JH6,Nature Made Fish Oil Pearls 500 mg (Omega-3 Supplement) Softgels 90 Ct
B010RS9MM6,Nature Made Max Strength: Magnesium 500 mg Softgel 60 Ct
B010RS6TIQ,"Nature Made Melatonin Plus Supplement with 200 mg L-Theanine, 60 Count"
B010RSAWMU,Nature Made Max Strength: Biotin (B7) 5000 mcg. Softgels Value Size 120 Ct
B010RSCRYQ,"Nature Made VitaMelts Fast Dissolve Vitamin C 60mg, 100ct"
B010RSC6FG,Nature Made Fiber Adult Gummies (6 g of Inulin Dietary Fiber per serving) 90 Ct
B010RSC03Y,Nature Made Super Saw Palmetto 480 mg. Extract Softgels 30 Ct
B010RS9UXC,"Nature Made Maximum Strength Vitamin D 10,000 I.U. Softgel, 60 Count"
B010RSDF9W,Nature Made VitaMelts Fast Dissolve Zinc 15 mg. (Immune Support) 100ct
B010RS9EKQ,Nature Made Max Strength: Vitamin B12 5000 mcg. Softgels 60 Ct
B010RSD6RI,Nature Made VitaMelts Fast Dissolve Energy Vitamin B12 1500 mcg 100 ct
B010RSEK1E,Nature Made Vitamin C 500 mg w. Rose Hips Caplets 130 Ct
B010RSBB2A,"Nature Made Hair, Skin &amp; Nails w. 2500 mcg of Biotin Softgels 60 Ct"
B010RSDZ5Q,Nature Made VitaMelts Fast Dissolve Calcium 100 mg. + D3 300 IU (Bone Support) 100ct
B010RSEOF6,Nature Made High Potency Biotin (B7) 2500 mcg. Softgels 90 Ct
B010RSCYAI,"Nature Made VitaMelts Fast Dissolve Vitamin D3 1000 IU, 100 ct"
B010RSE3UW,Nature Made VitaMelts Fast Dissolve Multivitamin (12 Key Vitamins) 100ct
B010RSDTNE,Nature Made VitaMelts Fast Dissolve Hair Skin &amp; Nails (Biotin 2500 mcg + Vitamin C 60 mg) 100ct
B010S568YI,"Perrier Carbonated Mineral Water, 8.45 fl oz. Slim Cans (10 Count)"
B010S55JWK,"NESTLE SPLASH Water Beverages with Natural Fruit Flavors, Mandarin Orange 16.9-ounce plastic bottles (Pack of 6)"
B010S577L6,"Perrier Pink Grapefruit Flavored Carbonated Mineral Water, 8.45 fl oz. Slim Cans (10 Count)"
B010S56PXC,"Perrier Lime Flavored Carbonated Mineral Water, 8.45 fl oz. Slim Cans (10 Count)"
B010SI38NE,"Breathe Right Extra Clear Drug-Free Nasal Strips for Nasal Congestion Relief, 10 count"
B010SI68D6,"Gaviscon Antacid Extra Strength Chewable Tablets, Cherry, 100 Count"
B010SI8DCK,"Nicorette Mini Lozenge Mint Stop Smoking Aid, 4 mg, 20 Count"
B010SI2ZDS,"Breathe Right Nasal Strips to Stop Snoring, Drug-Free, Extra Tan, 26 count"
B010SIAVCU,"TUMS Antacid Chewable Tablets, Extra Strength for Heartburn Relief, Assorted Fruit, 96 count"
B010SIBRBO,"TUMS Antacid Chewable Tablets, Extra Strength for Heartburn Relief, Assorted Berries, 48 count"
B010SI8NOI,"Os-Cal 500 Plus 200 D Calcium Tablets, 75 Count"
B010SI5ERC,"Gaviscon Extra Strength Chewable Antacid Tablets, Original, 100 Count"
B010SIACVA,"TUMS Antacid Chewable Tablets, Extra Strength for Heartburn Relief, Assorted Fruit, 48 count"
