asin,title
B00005BPJO,"HERSHEY'S Milk Duds Candy, 5 Ounce(Halloween Candy)"
B0000DIWNI,"Saran Premium Plastic Wrap, 100 Sq Ft"
B0000DIWNZ,"Saran Cling Plus Plastic Wrap, 200 Sq Ft"
B00032E8XK,"Chicken of the Sea, Solid White Albacore Tuna in Water, 5 Oz"
B0005ZYFM4,"Hidden Valley Salad Dressing Original Ranch, 8 oz"
B00061EU6S,One 24 oz Bob's Red Mill Graham Flour
B00099XLXU,QKR STNDRD OATMEAL - QUICK 18OZ
B00099XO5U,Progresso Plain Bread Crumbs 15 oz Canister
B00099XNXS,"Manwich Original Sloppy Joe Sauce, 15 Oz."
B00099XPNQ,"Del Monte Canned Sweet Peas, 15-Ounce"
B00099XPP4,"Del Monte Canned Fresh Cut Sweet Corn Cream Style, 14.75 Oz"
B00099XPMC,"Del Monte Canned Blue Lake French Style Green Beans, 14.5-Ounce"
B00099XP4A,"Del Monte Pear Halves, Lite, 15 Oz"
B00099XO50,"Progresso Italian Style Bread Crumbs, 15 oz"
B00099XPD6,"Carnation Evaporated Milk, 12 Fl Oz"
B00099XO3W,"Progresso Soup, Vegetable Classics, Lentil Soup, 19 oz Can"
B00099XPMM,"Del Monte Canned Fresh Cut Blue Lake No Salt Added Cut Green Beans, 14.5-Ounce"
B0009EXQLM,"Squip Nasaline Salt-box Of 50 Pre-measured Packets, 400 Ounce"
B000GCHLWC,"Johnson's Baby Shampoo, 15 fl. oz."
B000GGJDNI,"Aquafresh Extreme Clean Whitening Action Fluoride Toothpaste for Cavity Protection, 5.6 ounce"
B000HDCNAU,"BUMBLE BEE Snack on the Run! Tuna Salad with Crackers Kit, Canned Tuna Fish, Good Source of..."
B000KEIPC6,"American Crew Forming Cream, 3 ounce"
B000OUYNC2,"Welch's 100% Juice, Concord Grape, No Sugar Added, 64 Ounce Bottle"
B000OUYN5Y,"Dole Fruit Bowls, Peaches in Strawberry Gel, 4.3 Ounce (4 Cups), All Natural Diced Peaches in Strawberry-Flavored Gel, Non-GMO Gluten-Free Fat-Free"
B000OV4FY2,"Dole Fruit Bowls, Diced Peaches in 100% Fruit Juice, 4 Ounce (4 Cups), All Natural Diced Peaches Packed in Fruit Juice, Naturally Gluten Free, Non-GMO, No Artificial Sweeteners"
B000P6L52Q,"Annie's Macaroni and Cheese, Shells &amp; White Cheddar, 6 oz. Box"
B000PKJB6Y,"Jet-Puffed Miniature Marshmallows, 16 Ounce Bag"
B000PKJB4G,"Opti-Free Replenish Multi-Purpose Disinfecting Solution with Lens Case, 10-Ounces"
B000PL0YG4,"Pasta Roni Angel Hair Pasta with Herbs, 4.8 oz"
B000PL0YI2,"C&amp;H Pure Cane Sugar, Confectioners Powdered, 16 Oz"
B000PL2VTW,"Rice A Roni, Herb &amp; Butter Flavor, Rice Mix, 7.2 oz"
B000PL69NG,"Betty Crocker Frosting, Rich &amp; Creamy Gluten Free Frosting, Vanilla, 16 oz Canister"
B000PUDOX0,"Starbucks House Blend Whole Bean Coffee (Medium), 12 Oz"
B000PUIPXO,"Starbucks Espresso Roast Whole Bean Coffee (Dark), 12 Oz"
B000PUJ01K,PASTA RONI SHELL WHT CHEDDAR 6.2OZ
B000PWIR7Q,QKR MINI RCE SNCKS CHDDR 6.06OZ
B000PYB5PA,"Newman's Own Dressing, Balsamic Vinaigrette, 16 Fl Oz"
B000PYE2H8,"Newman's Own Salsa, Medium Chunky, 16 Oz"
B000Q3EAVG,"Hormel Corned Beef Hash, Homestyle, 15 Oz"
B000Q3FRP4,"Rosarita Vegetarian Refried Beans, 16 oz, 12 Pack"
B000Q5K1WG,"BUSH'S BEST Pinto Beans, Canned Beans, Prime Pantry, 16 oz."
B000Q5G7KG,"Dole Fruit Bowls, Pineapple Tidbits in 100% Pineapple Juice, 4 Ounce (4 Cups), All Natural Pineapple Tidbits Packed in Pineapple Juice, Naturally Gluten-Free, Non-GMO, No Artificial Sweeteners"
B000Q5K1O4,"Dole Pineapple Juice, 46 Oz"
B000Q5KV1C,"Progresso Soup, Traditional, Chicken &amp; Sausage Gumbo Soup, 18.5 oz"
B000Q5K1RG,"Dole Fruit Bowls, Mandarin Oranges in 100% Fruit Juice, 4 Ounce (4 Cups), All Natural Mandarin Orange Segments Packed in Fruit Juice, Naturally Gluten-Free, Non-GMO, No Artificial Sweeteners"
B000Q5NG9G,Progresso Gluten Free Rich &amp; Hearty Chicken Corn Chowder Soup 18.5 oz. Can
B000Q5LWE2,"Progresso Rich and Hearty Chicken and Homestyle Noodles Soup, 19 oz"
B000Q5NFMY,"Progresso Soup, Reduced Sodium, Roasted Chicken Noodle Soup, 18.5 oz Can"
B000Q5NG78,"Progresso Soup, Rich &amp; Hearty, New England Clam Chowder Soup, Gluten Free, 18.5 oz Can"
B000Q5PDNI,"Progresso Soup, Traditional, Hearty Chicken &amp; Rotini Soup, 19 oz Can"
B000Q5NFJW,"Progresso Traditional Soup, New England Clam Chowder, 18.5 oz"
B000Q68WSA,"Morton Coarse Kosher Salt Box, 48 Ounce"
B000Q68W4E,Progresso Cannellini Beans 15 oz.
B000Q6B1XI,"Old Spice Aluminum Free Deodorant for Men High Endurance, Pure Sport Long Lasting Stick, Lemon Lime Scent, 2.25 Oz"
B000QCJ7UQ,"Kikkoman Soy Sauce, 10 Fl Oz"
B000QCPNZY,"Krusteaz Cornbread and Muffin Mix, Honey, 15-Ounces"
B000QJ8SM2,"Old El Paso Taco Shells, Stand 'n Stuff, 10 Count"
B000QJ8SY0,"Velveeta Shells &amp; Cheese Dinner, 12 oz"
B000QJCLG6,"Pop Secret Popcorn, Butter, Microwave Bags 3 Count Box"
B000QJUDYS,"Stagg Classic Chili With Beans, 15 Ounce"
B000QJOTN4,"Ricola Natural Herb Cough Drops, Original, 1 Pack"
B000QSFWBI,"Santa Cruz Organic Applesauce (6 Count, 4 Oz Each)"
B000QSHJZU,"Bob's Red Mill Baking Flour, Gluten Free, 22 Ounce"
B000QSJM96,"Santa Cruz Organic Apple-Apricot Sauce (6 Count, 4 Oz Each)"
B000QSL5FU,"Santa Cruz Organic Apple-Cinnamon Sauce (6 Count, 4 Oz Each)"
B000QSL582,"King Arthur All Purpose Flour, Unbleached, 5 Pounds"
B000QSTKFC,"Red Star Active Dry Yeast, 3 Count"
B000QSTJYO,"Thai Kitchen Organic Coconut Milk, 13.66 oz"
B000QU1VXE,"Lundberg Rice Chips, Sea Salt, 6 Oz"
B000QU3N7Q,"Kashi, Chewy Granola Bars, Peanut Peanut Butter, Non-GMO Project Verified, 7.4 oz (6 Count)"
B000QV32C6,"Lundberg Family Farms White Basmati Rice, 32 Ounce"
B000QV32CQ,"Lundberg Family Farms Organic Short Grain Rice, Brown, 32 Ounce"
B000QV54Y0,"Lundberg Family Farms Basmati Rice, California Brown, 32 Ounce"
B000QV54YK,"Lundberg Family Farms Organic Basmati Rice, California Brown, 32 Ounce"
B000QV5M6A,"Tinkyada Brown Rice Pasta, Penne, 16 Oz"
B000QWSG62,"Diet Hansen's Soda, Ginger Ale (6 Count, 12 Fl Oz Each)"
B000QWSDEW,"Annie's Organic Macaroni &amp; Cheese, Shells &amp; White Cheddar, 6 oz. Box"
B000QWVZZQ,"San-J Organic Tamari Soy Sauce, Reduced Sodium, 10 Fl Oz"
B000QY7PQ2,"Lundberg Family Farms Organic Brown Rice Cakes, 8.5 Ounce"
B000QY9SQC,"Spectrum Organic Ground Flaxseed, 14 Oz"
B000QYCJTK,"Lundberg Family Farms Rice Cakes, Tamari Seaweed, 8.5 Ounce"
B000QYCJOU,"Lundberg Family Farms Rice Cakes, Brown Rice, 8.5 Oz"
B000QYI1R4,"Advil PM (20 Count) Pain Reliever/Nighttime Sleep Aid Coated Caplet, 200mg Ibuprofen, 38mg Diphenhydramine"
B000R2Z9BQ,"Starbucks House Blend Ground Coffee (Medium), 12 Oz"
B000R2Z8P8,"Arizona Green Tea with Ginseng and Honey, 128 Fl Oz"
B000R2Z790,"Capri Sun Juice Drink, Orange (10 Count, 6 Fl Oz Each)"
B000R2Z2W2,"Farmhouse Rice Long Grain &amp; Wild Rice Herb &amp; Butter Flavor, 4 Oz"
B000R30PP0,"Sunsweet Gold Label Prune Juice, 64 Fl Oz"
B000R30YM4,"Capri Sun Juice Drink, Wild Cherry (10 Count, 6 Fl Oz Each)"
B000R2Z5VU,"Jiffy Muffin Mix, Corn, 8.5 Oz"
B000R36GMQ,"Adams Natural Peanut Butter, Creamy, 16 Oz"
B000R36J0A,"Capri Sun Drink, Mountain Cooler, 6 oz, 10 ct."
B000R4CGSI,"S&amp;W Kidney Beans, 50% Less Sodium, 15.25 Oz"
B000R4CGYM,"C&amp;H Pure Cane Powdered Confectioners Sugar, 32 Oz"
B000R4CHFA,"Tree Top 100% Apple Juice (6 Count, 5.5 Fl Oz Each)"
B000R4FGFI,"S&amp;W Black Beans, 50% Less Sodium, 15 Oz"
B000R4FGS0,"C&amp;H Pure Cane Sugar Golden Brown, 32 Oz"
B000R4EL4K,"C&amp;H Pure Cane Dark Brown Sugar, 32 Oz"
B000R4FGR6,"C&amp;H Pure Cane Granulated White Sugar, 5 Pounds"
B000R4G6JS,"Tapatio Salsa Picante Hot Sauce, 10 Fl Oz"
B000R4H3D6,"Krusteaz Pancake Mix, Buttermilk, 56 Oz"
B000R4M8GI,"Blue Diamond Almonds Nut-Thins Cracker Crisps, Pecan 4.25 Ounce"
B000R4NP24,"Blue Diamond Almonds Nut Thins Cracker Crisps, Original, 4.25 Ounce"
B000R6QADI,"Simply Organic Vanilla Extract, 4 Fl Oz"
B000R738KU,"Almond Breeze Dairy Free Almondmilk, Unsweetened Vanilla, 32 Fluid Ounce"
B000R737EW,"Almond Breeze Dairy Free Almondmilk, Original, 32 Fluid Ounce"
B000R73XZ0,"Bragg Organic Apple Cider Vinegar, 16 Fl Oz"
B000R73YR2,"Muir Glen Canned Tomatoes, Organic Crushed Tomatoes with Basil, No Sugar Added, 28 Ounce Can"
B000R70A24,"Muir Glen Organic Pasta Sauce, Tomato Basil, No Sugar Added, 25.5 Ounce Glass Jar"
B000R775RW,"Almond Breeze Dairy Free Almondmilk, Vanilla, 32 Fluid Ounce"
B000R77504,"Almond Breeze Dairy Free Almondmilk, Unsweetened Original, 32 Fluid Ounce"
B000R77WGQ,"Almond Breeze Dairy Free Almondmilk, Unsweetened Chocolate, 32 Fluid Ounce"
B000R77DYW,"RICE DREAM Enriched Original Organic Rice Drink, 32 Fluid Ounce ( Packaging May Vary )"
B000R7A7IG,"West Soy Organic Soymilk, Unsweetened Vanilla, 32 Fl Oz"
B000R7C0ZO,"SOY DREAM Enriched Original Organic Soymilk, 32 Fluid Ounce"
B000R71Y4C,"Muir Glen Canned Tomatoes, Organic Diced Tomatoes, No Sugar Added, 28 Ounce Can"
B000R7V3JI,"Pacific Foods Organic Creamy Roasted Red Pepper &amp; Tomato Soup, 32oz"
B000R7X3YQ,"Pacific Foods Organic Free Range Chicken Broth, Low Sodium, 32oz"
B000R7YYIK,"Pacific Foods Organic Beef Broth, 32oz"
B000R7V3DE,"Pacific Foods Organic Free Range Chicken Broth, 8oz, 4-Pack"
B000R7ZMOU,"Pacific Foods Organic Vegetable Broth, Low Sodium, 32oz"
B000R7YYTO,"Pacific Foods Organic Creamy Tomato Soup, 32oz"
B000R91CSS,Betty Crocker Scooby Doo Fruit Flavored Snacks Assorted Flavors 10-0.8 oz Pouches
B000R91CRO,"Betty Crocker Fruit Snacks, Gushers, Variety Snack Pack, 6 Pouches, 0.9 oz Each"
B000R93IZ8,"Ziploc Slider Storage Bags, Quart, 20 Count"
B000R93K1U,"Brianna's Home Style Poppy Seed Dressing, 12 Fl Oz"
B000R95BSU,Betty Crocker Super Moist Cake Mix Milk Chocolate 15.25 oz Box
B000R95BDK,"Pop Secret Popcorn, Homestyle, 3.2 Ounce Microwave Bags, 3 Count Box"
B000R95BH6,"Betty Crocker Chocolate Chip Cookie Mix, 17.5 oz"
B000RA6GMY,Glad Food Storage Containers - Soup and Salad Containers - 24 Ounce - 5 Count
B000RA9N1A,"Heinz Apple Cider Vinegar, 16 Ounce"
B000RAAHY2,"Tea's Tea Unsweetened Jasmine Green Tea, 16.9 oz"
B000RA6L42,"ReaLime 100% Lime Juice, 8 Fluid Ounce Bottle"
B000RAB8IG,"Sweet Baby Ray's Barbecue Sauce, 18 Oz"
B000RAFMPG,"Tea's Tea Unsweetened Pure Green Tea, 16.9 oz"
B000RFXB18,"Lundberg Family Farms Risotto, Creamy Parmesan, 5.5 Ounce"
B000RK4GNA,"Starbucks Breakfast Blend Medium Roast Ground Coffee, 12-Ounce Bag"
B000RK4BFI,"Grey Poupon Dijon Mustard, 10 oz Squeezable Bottle"
B000RLPJRG,"Del Monte Canned Yellow Cling Sliced Peaches in 100% Fruit Juice, 15-Ounce"
B000RLPKMA,"Stagg Silverado Beef Chili with Beans, 15 Ounce"
B000RLT42W,"Minute Maid Coolers, Berry Punch (10 Count, 6.75 Fl Oz Each)"
B000RLT4AE,"Wheat Thins Original Crackers - Family Size, 16 Ounce"
B000RLT3GO,"Contadina Pizza Sauce, 15 Oz"
B000RO2EJ4,"Rice A Roni, Chicken, 6.9 Oz"
B000RPS5L4,"C&amp;H Pure Cane Sugar Cubes, 252 Count"
B000RPUCQK,"Quaker Oats, Old Fashioned, 18 Oz"
B000RPUCOM,"Idahoan Mashed Potatoes, Butter &amp; Herb, 4 Oz"
B000RPTYXC,"C&amp;H Sugar Baker's Sugar, Pure Cane Ultrafine, 4 Pounds"
B000RPUDX2,"Quaker Rice Crisps, Apple Cinnamon, 3.52 oz Bag (Packaging May Vary)"
B000RPUCM4,"Idahoan Mashed Potatoes, Four Cheese, 4 oz."
B000RPVWSW,"DAVID Roasted and Salted Pumpkin Seeds, 2.25 oz"
B000RPYUA4,"Del Monte Canned Fresh Cut Green Beans, 8-Ounce"
B000RPYZ5E,"Quaker Popped Rice Snacks, Cheddar Cheese, 3.03 Oz"
B000RPXTC4,"Minute Maid Coolers, Pink Lemonade (10 Count, 6.75 Fl Oz Each)"
B000RULU16,"Starbucks Caffe Verona Ground Coffee (Dark), 12 Oz"
B000RUP4EA,"BUMBLE BEE Solid White Albacore Tuna in Oil, Gluten Free Food, Canned Tuna, High Protein Snack, 5 Ounce"
B000RUQOLM,"Stagg Vegetarian Garden 4-Bean Chili, 15 Ounce"
B000RUQOKI,"Stagg Chili, Ranch House Chicken, 15 Oz"
B000RY6G3E,"Dole Mixed Tropical Fruit in Light Syrup &amp; Passion Fruit Juice, 15.25 Ounce Can, All Natural Pineapple Red Papaya &amp; Yellow Papaya in Light Syrup &amp; Passion Fruit Juice, Pop &amp; Peel Lid"
B000RY6GL6,"BUSH'S BEST Original Baked Beans, Canned Beans, Prime Pantry, 16 oz."
B000RY6GMU,Bush's Best Vegetarian Baked Beans 28 oz
B000RY8FZ6,"Log Cabin Syrup, Original, 24 Ounce"
B000RY8O5M,"Carnation Evaporated Milk, Lowfat 2%, 12 Fl Oz"
B000RY8CTK,"Blue Diamond Almonds, Smokehouse, 6 Oz"
B000RYD63W,"Sun-Maid Raisins, 20 Oz"
B000RYCJ12,"Farmhouse Rice Mexican Style, 6 Oz"
B000RYBUD0,"Dole Mandarin Oranges, Whole Segments in Light Syrup, 15 Ounce Can, All Natural Mandarin Orange..."
B000RYD1UA,"Ocean Spray Cranberry Sauce, Jellied, 14 Fl Oz"
B000RYD3FI,"Dole Crushed Pineapple, 20 Oz"
B000RYFQ76,"Lea &amp; Perrins Worcestershire Sauce, 15 fl oz Bottle"
B000RYCB7Y,"Carnation Evaporated Milk, Fat Free, 12 Fl Oz"
B000S5ME38,"Honey Maid Cinnamon Graham Crackers, 14.4 Ounce"
B000S5OA8U,"Red Oval Farms Stoned Wheat Thin Crackers, 10.6 Ounce"
B000S5PHQO,"Handi-Snacks Ritz Crackers &rsquo;N Cheese Dip, 6 Count Individual Snack Trays"
B000S5PHGE,"Barnum's Animal Crackers - Snack-Sak, 8 Ounce"
B000S5S1DK,"Mrs. Meyer&acute;s Clean Day Hand Soap, Lemon Verbena, 12.5 fl oz"
B000S5S1AI,"Mrs. Meyer's Clean Day Dish Soap, Lemon Verbena, 16 fl oz"
B000S5TIPK,"Mrs. Meyer's Clean Day Fabric Softener, Lavender, 32 fl oz"
B000S5TJ54,"Mrs. Meyer&rsquo;s Clean Day Liquid Fabric Softener, Lemon Verbena Scent, 32 ounce bottle"
B000S5VE2K,"Mrs. Meyer&rsquo;s Liquid Hand Soap, Lavender, 12.5 fl oz"
B000S6NCOC,"Honey Maid Grahams, Honey, 28.8 Oz"
B000S6NDLE,"Ritz Toasted Chips, Original, 8.1 Ounce"
B000SEKSPK,"Haribo Goldbears, 5 Oz"
B000SEOHJ8,"Ginger People Minced Ginger, 6.7 Oz"
B000SQP4OS,"Kraft Caramels, 11 oz Wrapper"
B000SR5II4,"French&rsquo;s Crispy Fried Onions, Original, Crunchy Topping, Onion Flavoring, 2.8 oz"
B000SRGDJ2,"Amy's Soups, Organic Lentil Soup, 14.5 Ounce"
B000SRHPBC,"Garden of Eatin' Sesame Blues Chips, 7.5 Oz"
B000SRHH3I,"Bumble Bee Skinless &amp; Boneless Chunk Light Pink Salmon in Water, 5 Oz"
B000SRI2HI,"Mezzetta Roasted Red Bell Peppers, 16 Oz"
B000SRJLE6,"BUMBLE BEE PRIME FILLET Solid White Albacore Tuna in Water, Gluten Free Food, Canned Tuna, High Protein Snack, 5 Ounce Can"
B000SRJMVI,"Chicken of the Sea, Pink Salmon, 5 Oz"
B000SRJTIE,"Garden of Eatin' Tortilla Chips, Chili &amp; Lime, 8.1 Oz"
B000SRI61U,"ReaLemon 100% Lemon Juice, 8 Fluid Ounce Bottle"
B000SRK8V6,"Pacific Foods Organic Almond Original Plant-Based Beverage, 32oz"
B000SRMC3I,"UNCLE BEN'S Ready Rice: Whole Grain Brown, 8.8oz"
B000SRK8KC,"Old Spice High Endurance Body Wash, Fresh, 18 Fl Oz"
B000SRMAT4,"Sunsweet Bite-Size Prunes, 9 Oz"
B000SRLJ46,"Kettle Brand Potato Chips, Sea Salt &amp; Vinegar, 5 Ounce Bag"
B000SRKA6E,SKIPPY Peanut Butter Spread - Creamy - Natural - 15 Ounce
B000SSS6AU,"Scotch-Brite Non-Scratch Scrub Sponge, 3-Sponges"
B000SSS5VA,Newman's Own Microwave Popcorn Sea Salt - 3 Count
B000SSW4R6,"Betty Crocker Frosting, Rich &amp; Creamy Gluten Free Frosting, Chocolate, 16 Oz Canister"
B000ST14FI,"Quaker Natural Granola Cereal, 28 Oz"
B000T3OACW,"Reese Flat Fillets of Anchovies, 2-Ounces"
B000T43KG8,"Hoisin Sauce, 8.5 Oz"
B000UWJPQS,"TUMS Antacid Chewable Tablets for Heartburn Relief, Ultra Strength, Assorted Fruit, 72 Tablets"
B000UWLOUI,"TUMS Antacid Chewable Tablets, Ultra Strength for Heartburn Relief, Assorted Berries, 72 count"
B000UXVH9U,"Crofter's Organic Blackberry Spread, 10 Oz"
B000V5MAMA,"Del Monte Fresh Cut Golden Sweet Whole Kernel Corn, No Salt Added, 15.25 Oz"
B000V5T1M2,"Del Monte Canned Yellow Cling Sliced Peaches in Extra Light Syrup, 15-Ounce"
B000V9MVSE,"Irish Spring Deodorant Soap, Original Bar Soap (8 Count)"
B000V9YYAW,"Green Giant Whole Kernel Sweet Corn, 15.25 oz"
B000V9YXYY,"Contadina Canned Roma Style Tomato Paste, 6-Ounce"
B000VA2VK6,"Contadina Crushed Tomatoes, 28 Oz"
B000VA2ZFM,"Ortega Green Chiles, Mild Whole Chiles, 4 Ounce"
B000VA49CY,"Del Monte Canned Summer Crisp Gold Corn, 11-Ounce"
B000VA5X1U,"Dial Antibacterial Liquid Hand Soap, Gold, 7.5 Ounce"
B000VA5X88,"Green Giant Sliced Mushrooms, 4.5 oz"
B000VA7KH0,"Del Monte Canned Harvest Select Whole Green Beans, 14.5-Ounce"
B000VA7KL6,"Green Giant Cream Style Sweet Corn, 14.75 oz"
B000VA9RC6,"Del Monte Pear Fruit Cups , 4 Ounce each , 4 Pack"
B000VB25D8,"Dial Antibacterial Bar Soap, Spring Water, 4 Ounce, 3 Bars"
B000VB25I8,"Dial Complete Antibacterial Foaming Hand Wash, Original, 7.5 Fluid Ounces"
B000VCD86A,"Hormel Chili No Beans, 15 Ounce"
B000VCFD68,"Hormel Chili, with Beans, 15 Oz"
B000VCFAXO,"Borax 20 Mule Team Detergent Booster, 65 Oz"
B000VDQZFK,"Blue Diamond Almonds, Raw Whole Natural, 6 Ounce"
B000VDSP2G,"PAM Butter Cooking Spray, 5 Ounce"
B000VDRIMO,"Bob's Red Mill Cornmeal, Medium Grind, 24 Ounce"
B000VDT4M6,Fiber One Cereal Original 16.2 oz Box
B000VDT1YC,"Progresso Black Beans, 15 oz Can"
B000VDT94O,"Spray 'n Wash Pre-Treat Laundry Stain Remover, 22 fl oz"
B000VDT8A4,"Oscar Mayer Bacon Bits, 3 oz Pouch"
B000VDUK7Y,"Wheat Chex Breakfast Cereal, Oven Toasted Wheat Cereal, 14 oz Box"
B000VDUQDC,"Golden Star Jasmine Rice, 32 Oz"
B000VDUY02,"Wheaties Whole Wheat Flakes Cereal, 15.6 oz"
B000VDUXWQ,Basic 4 Cereal with Sweet Tangy Fruit and Almonds 16 oz Box
B000VDUV00,"Progresso Vegetable Classics Garden Vegetable Soup, 18.5 oz"
B000VDUUQA,Old El Paso Mild Green Chile Enchilada Sauce 10 oz Can
B000VDV1UO,"Goya Canned Black Beans, 15.5 Oz"
B000VDWSGU,"Cento Crushed Tomato, 28 Oz"
B000VDWTLO,"Da Vinci Farfalle Bowties, 16 Oz"
B000VDX22Y,"Pacific Foods Ultra Soy Non-Dairy Beverage, Original, 32-Ounces"
B000VDYSWM,"Herdez Salsa Casera, Medium, 16 Oz"
B000VDYM8C,"Chex Cereal, Corn, 14 Oz"
B000VDZ04M,"Fiber One Cereal, Honey Clusters, Whole Grain Cereal 14.25 Oz"
B000VELKGS,"Ginger People Ginger Chews, 3 Oz"
B000VH9MJ2,"Natural Value Waxed Paper Bags, 60 Count"
B000VHI5UE,"Living Harvest Hempmilk, Original, 32 Fl Oz"
B000VHJHA6,"Eden Red Wine Vinegar, 16 Fl Oz"
B000VHJG3E,"Lundberg Family Farms California White Jasmine Rice, 32 Ounce"
B000VHLGAK,"Bionaturae Organic Tomato Paste, 7 Oz"
B000VHNO5K,"Simply Organic Ground Cumin, 0.46 Oz"
B000VK11RK,"Earth's Best Organic Whole Grain Oatmeal Cereal, 8 Ounce"
B000VK2L1K,"Nature's Path Organic Pumpkin FlaxPlus Granola, Pumpkin Seed + Flax, 11.5 Oz (Packaging may vary)"
B000VK2QLA,"Annie's Organic Ketchup, 24 oz Bottle"
B000VK2RJQ,"Lundberg Family Farms Organic White Sushi Rice, 32 Ounce"
B000VK2RBO,"Bionaturae Organic Pasta, Penne Rigtate, 16 Oz"
B000VK3SZI,"Bob's Red Mill Unsweetened Coconut Flakes, 12 Ounce"
B000VK3SHQ,"Earth's Best Organic Toddler Biscuits, Barley, 12 Count"
B000VK42NK,"Nature's Path Flax Plus Raisin Bran Cereal, 14 Oz"
B000VK47AS,"Nature's Path Organic Instant Hot Oatmeal, Optimum Power, Blueberry Cinnamon Flax, 8 Count"
B000VK43BG,"Annie's Organic Bunny Grahams, Honey, 7.5 oz. Box"
B000VK49HY,"Amy's Soups, Light in Sodium Organic Lentil Vegetable Soup, 14.5 Ounce"
B000VK3SOY,"Earth's Best Organic Sesame Street Sunny Day Toddler Snack Bars with Cereal Crust, Strawberries, 8..."
B000VK484I,"Joyva Sesame Tahini, 15 Oz"
B000VK45MS,"Made In Nature Organic Dried Apricots, 6 Oz"
B000VK47XA,"Amy's Beans, Organic Light in Sodium Refried Black Beans , 15.4 Ounce"
B000VK43A2,"Annie's Bunny Grahams, Chocolate, Graham Snacks, 7.5 oz Box"
B000VK2MGO,"EnviroKidz Organic Koala Crispy Rice Bars, Chocolate, 6 Count"
B000VK6F94,"Newman's Own Organic Cranberries, 4 Oz"
B000VK45LO,"Made In Nature Organic Dried Pineapple, 3 Oz"
B000VK6HMO,"Amy's Beans, Organic Traditional Refried Beans, 15.4 Ounce"
B000VK5VJO,"Bob's Red Mill Organic Unbleached White Flour, 5 Pounds"
B000VK7Y80,"EnviroKidz Koala Crisp Cereal, Chocolate, 11.5 Oz"
B000VK7YTE,"Barbara's Bakery Puffins Cereal, Peanut Butter, 11 Ounce"
B000VK7T3U,"Westbrae Natural Organic Black Beans, 15 Ounce"
B000VK7YG2,Cascadian Farms Multigrain Square Cereal 12.3 oz
B000VK6J9A,"Amy's Soups, Organic Lentil Vegetable Soup, 14.5 Ounce"
B000VK81EG,"Made In Nature Organic Plums, 6 Oz"
B000VK7YP8,"Barbara's Cereal, Puffins, 10 Ounce"
B000VK81EQ,"Made In Nature Organic Smyrna Figs, 7 Oz"
B000VK860A,"Amy's Soups, Organic Black Bean Vegetable Soup, 14.5 Ounce"
B000VK81HS,"Bare Fruit, Organic Dried Mangos, 2.2 Oz"
B000VK7O76,"Earth's Best Organic Sesame Street Sunny Day Toddler Snack Bars with Cereal Crust, Apple, 8 Count Box"
B000VK814G,"Newman's Own Organic Raisins, 15 Oz"
B000VK9XYI,"Newman's Own Organic Prunes, 6 Oz"
B000VKA2GQ,"Food Merchants Organic Polenta, Traditional Italian, 18 Ounce"
B000VKA1SK,"Lundberg Family Farms Organic Basmati Rice, California White, 32 Ounce"
B000VKA1I0,"Ancient Harvest Corn &amp; Quinoa Rotini Organic Supergrain Pasta, 8 Ounce"
B000VK9XSO,"Blue Diamond Almonds Nut Thins Cracker Crisps, Cheddar Cheese, 4.25 Ounce"
B000VK85XS,"Amy's Soups, Organic Fire Roasted Southwestern Vegetable Soup, 14.3 Ounce"
B000VKA1SA,"Lundberg Family Farms White Arborio Rice, 32 Ounce"
B000VM0UHA,"Waxtex Wax Paper, 75 Sq Ft"
B000VM2KY6,"Marukan Genuine Brewed Rice Vinegar, 12 Fl Oz"
B000VM2NPM,"Saffola Oil Safflower, 24 Oz"
B000VM2O5Q,"Softsoap Liquid Hand Soap, Soothing Aloe Vera - 7.5 fluid ounce"
B000WCYBEC,"Amy's Chilis, Organic Medium Chili, 14.7 Ounce"
B000WCZ57Y,"TERRA Original, Sea Salt, 1 Ounce"
B000WCZN9Y,"Amy's Soups, Light in Sodium Organic Split Pea Soup, 14.1 Ounce"
B000WCZNNA,"Amy's Soups, Light in Sodium Organic Lentil Soup, 14.5 Ounce"
B000WCZN7Q,"Amy's Chilis, Organic Black Bean Chili, 14.7 Ounce"
B000WD3DAO,"Annie's Cheddar Bunnies, Baked Snack Crackers, 6 Snack Packs, 6 oz Box"
B000WD3912,"Newman's Own Organic Pop's Corn Microwave Popcorn, Butter, 3 Count"
B000WD3JEY,Cascadian Farms Rain Bran 12 oz
B000WD3PSY,"Amy's Soups, Organic Cream of Mushroom Soup, 14.1 Ounce"
B000WD397G,"Newman's Own Organic, Pretzels, Hi-Protein, 7 oz"
B000WD5KNC,"Annie Chun's Rice Express Sticky White Rice, 7.4 oz"
B000WD5NNE,"Nature's Path Peanut Butter Granola Cereal, 11.5 Oz"
B000WD3Q9C,"Amy's Soups, Organic Thai Coconut Soup (Tom Kha Phak), 14.1 Ounce"
B000WD5AKA,"Bare Fruit Organic Fuji Red Apple Chips, Gluten-Free + Baked, 2.2-Ounce Bag"
B000WDOZ0Q,"Cascadian Farm Organic Granola, Oats and Honey Cereal, 16 oz"
B000WDPAP0,"Atkins Gluten Free Protein-Rich Shake, Dark Chocolate Royale, 4 Count"
B000WD5VUO,"Bionaturae Organic Pasta, Whole Wheat Penne, 16 Oz"
B000WG65W4,"French's Classic Yellow Mustard, Stone Ground Mustard, Gluten Free, All Natural, 20 oz"
B000WGB3QM,"Arm &amp; Hammer Baking Soda, 64 Oz"
B000WGY7TC,"Yamamotoyama Yaki Nori Roasted Seaweed Choice (10 Count, 0.88 Oz Each)"
B000WGY7OM,"Dynasty Sliced Water Chestnuts, 8 Oz"
B000WH4Q6A,Fiber One Bar Oats and Peanut Butter 5 - 1.4 oz Bars
B000WH2I6K,"Stubb's Barbecue Sauce, Original, 18 Oz"
B000WH5V2S,"Seattle's Best Coffee Portside Blend (Previously Signature Blend No. 3) Medium Roast Ground Coffee, 12-Ounce Bag"
B000WHAI6W,"Quaker S'Mores Granola Bars, 8 ct.84 oz each"
B000WHO1SI,"Sanpellegrino Orange Sparkling Fruit Beverage, 11.15 fl oz. Cans (6 Count)"
B000WHTWD2,"Mott's Unsweetened Applesauce, 3.9 Ounce Cup, 6 Count"
B000WHZMJK,"Sour Patch Kids Candy (Original, 14 Ounce Bag)"
B000WHXMYW,"Heinz Tomato Ketchup, 64 oz Value Size Bottle"
B000WLEAYO,"Bush's Best Baked Beans, Vegetarian, 16 Oz"
B000WLJINM,"Cento Peeled Plum Tomatoes, Italian Style with Basil Leaf, 28 Oz"
B000WLW9HY,"Crystal Geyser Sparkling Mineral Water (4 Count, 18 Fl Oz Each)"
B000WM2WWK,"Native Forest Artichoke Hearts, Quartered, 14 Oz"
B000WM2WIY,Bionaturae Strained Tomatoes
B000XDIDOO,"Joy Dishwashing Liquid, Lemon Scent, 30 Ounce"
B000XGGX6G,"Frank's RedHot Original Cayenne Pepper, 12 fl oz"
B000YD1Q24,"Newman's Own Microwave Popcorn, Light Butter, 3 Count"
B000YD5NQ4,"Arrowhead Mills Organic Yellow Popcorn, 28 oz."
B000YD5PNU,"Stacy's Pita Chips, Multi-Grain, 8 Oz"
B000YE24TM,"Ecover Automatic Dishwasher Soap Tablets, Citrus, 25 Count"
B000YF7EI2,"Native Forest Pineapple Chunks, Organic, 14 Oz"
B000YFX5O4,"Annie Chun's Udon Noodle Soup, 5.9 Oz"
B000YFXM5Q,"Avalon Organics Tea Tree Mint Scalp Normalizing Shampoo, 14 oz."
B000YG3LT2,"Wolfgang Puck Organic Soup, Free Range Chicken Noodle, 14.5 Ounce"
B000YHXX8K,"Energizer MAX D Alkaline Batteries, 4-Count"
B000YHWDMM,"Energizer MAX AAA Batteries, Designed to Prevent Damaging Leaks (4 Count)"
B000YJXZ5E,"ACT Alcohol Free Anti-Cavity Fluoride Mouthwash Mint 18 oz Helps Prevent Cavities Children's, Strengthen Tooth Enamel and Freshen Breath with Fluoride &amp; Exact Dosage Meter"
B000YK0S58,"Band-Aid Brand Tough-Strips Adhesive Bandage for Minor Cuts &amp; Scrapes, Extra Large Size, 10 ct"
B000YM2QCY,"Alba Botanica Very Emollient, French Lavender Bath &amp; Shower Gel, 12 Ounce"
B000YM4SHK,"Once Again, Sunflower Seed Butter, Lightly Sweetened, Organic, 16 oz"
B000YM9RK8,"Marukan Seasoned Rice Vinegar, Organic, 12 Fl Oz"
B000YM6IH8,"Santa Cruz Organic, Dark Roasted Peanut Butter, Creamy, Organic, 16 oz"
B000YMBJ4A,"Living Harvest Hempmilk, Chocolate, 32 Fl Oz"
B000YQNH4Q,"Cascadian Farm Organic Cereal, Honey Nut O's, 9.5 oz"
B000ZZWAB2,"Alba Botanica Drink It Up Coconut Milk Hawaiian Conditioner, 12 oz."
B001001KA8,"Alba Botanica Drink It Up Coconut Milk Hawaiian Shampoo, 12 oz."
B00104IZ48,"Pacific Foods Organic Creamy Tomato Soup, Light Sodium, 32oz"
B00104LSDI,"Pacific Foods Organic Cashew Carrot Ginger Soup, 32oz"
B0010B3CNU,"Hamburger Helper Classic, Stroganoff, 5.6 Oz"
B0010C6K4M,"Natural Value Tall Kitchen Drawstring Plastic Bags, 20 Count"
B0010C4P0S,"Newman's Own Organic Salted Rounds Pretzel, 8 Oz"
B0010NOONU,"Arm &amp; Hammer Complete Care Plus Whitening Toothpaste, 6.0 Oz"
B0010XPYFC,"Minute Instant Brown Rice, 14 Oz"
B0010XQ5C8,"Tree Top Natural Apple Sauce, 23.8 Oz"
B0010XQ27G,"Ocean Spray 100% Juice, Cranberry Pomegranate, 60 Fl Oz"
B0010XRZ7W,"Ocean Spray Cranberry Cocktail Juice, 64 Fl Oz"
B0010XS2CE,"Softsoap Liquid Hand Soap, Lavender and Chamomile - 7.5 Fluid Ounce"
B0010XV5T6,"Wholesome Sweeteners Organic Sugar, 64 oz."
B0010XVS0M,"Starkist Chunk White Albacore Tuna Pouch, 2.6 Oz"
B0010YWJYK,"Starbucks French Roast Ground Coffee (Intense and Smoky), 12 Oz"
B00112HPHM,"Hansen's Soda, Tonic (6 Count, 8 Fl Oz Each)"
B00112JH0U,"Mezzetta Sliced Hot Jalapeno Peppers, 16 Oz"
B00112KYSE,"Mezzetta Artichoke Hearts, 6.5 Oz"
B00113KB2W,"DeLallo Pasta, Elbows, 16 Oz"
B00119QOWW,"Pert Plus 2 in 1 Classic Clean Shampoo &amp; Conditioner, 25.4 Fl Oz"
B00119VI2I,"Poise Pads, 20 Count"
B0011BPN7C,"Carr's Whole Wheat Crackers, 7 Oz"
B0011CVP1O,"Carr's Table Water Crackers, 4.3 Oz"
