asin,title
B016I1QGNE,"CESAR CANINE CUISINE Wet Dog Food with Chicken and Liver, (24) 3.5 oz. Trays"
B016I1PQZI,"CESAR SAVORY DELIGHTS Wet Dog Food Filet Mignon Flavor with Bacon &amp; Potato, (24) 3.5 oz. Trays"
B016I1QO68,PEDIGREE MARROBONE Real Beef Flavor Snacks for Dogs 24 Ounces (Pack of 8)
B016I1Q8KA,"TEMPTATIONS Classic Cat Treats Savory Salmon Flavor, (12) 3 oz. Pouches"
B016I1OPNM,PEDIGREE LITTLE CHAMPIONS Grilled Flavors in Sauce With Chicken Wet Dog Food 5.3 oz (Pack of 24)
B016I1OLE0,"CESAR HOME DELIGHTS Wet Dog Food Turkey, Green Beans &amp; Potatoes Dinner, (24) 3.5 oz. Trays"
B016I1P5RW,TEMPTATIONS Classic Treats for Cats Tasty Chicken Flavor 16 Ounces (Pack of 4)
B016I1QK7Q,PEDIGREE LITTLE CHAMPIONS Senior Complete With Lamb and Rice Wet Dog Food 5.3 oz. (Pack of 24)
B016I1OBL8,"TEMPTATIONS Classic Treats for Cats Seafood Medley Flavor, 12 oz. Pouch (Pack of 5)"
B016I896WA,"KIND Healthy Grains Bars, Popped Salted Caramel, Non GMO, Gluten Free, 1.2 oz, 5 Count"
B016KZTT8C,"Folgers Gourmet Supreme Coffee, 24.2 Ounce"
B016KZVAHA,"Back to Nature Non-GMO Nuts, Salted California Almonds, 9 Ounce"
B016KZTLQC,"Folgers 1/2 Caff Coffee, 25.4 Ounce"
B016KZUGKC,"Folgers Simply Smooth Coffee, 31.1 Ounce"
B016KZVDKY,"Back to Nature Non-GMO Trail Mix, California Coast, 9 Ounce"
B016KZUDEG,"Folgers House Blend Coffee, 24.2 Ounce"
B016KZTHY8,"Folgers Classic Roast Coffee, 30.5 Ounce"
B016KZU47C,"Folgers 100% Colombian Coffee, 24.2 Ounce"
B016KZU0AI,"Folgers Maryland Club Butter, Nut Coffee, 31.1 Ounce"
B016KZTPJU,"Folgers Breakfast Blend Coffee, 25.4 Ounce"
B016KZU79W,"Folgers French Roast Coffee, 24.2 Ounce"
B016LO7BWI,"Greenies Dental Dog Treats Regular Size, Original Flavor ( Package 18 Ounces, 18 Treats) Greenies Dog Dental Chews: For Clean Teeth and Healthy Gums"
B016LO8BJK,PEDIGREE JUMBONE Mini Bones Mini Snacks for Dogs 15.87 oz. 25 Count
B016LO7QD2,"Greenies Dental Dog Treats, Teenie Size, Fresh Flavor (43 Treats 12 Ounces) Greenies Dog Dental Chews: For Clean Teeth and Healthy Gums"
B016LO91UI,NUTRO MAX CAT Adult Salmon Flavor Dry Cat Food 6 Pounds
B016LO81CM,GREENIES Blueberry Flavor TEENIE Dog Dental Chews  - 12 Ounces 43 Treats
B016LO8VAO,NUTRO MAX CAT Adult Roasted Chicken Flavor Dry Cat Food 3 Pounds
B016LO8CZI,"PEDIGREE Adult Small Dog Roasted Chicken, Rice &amp; Vegetable Flavor Dry Dog Food  3.5 Pounds"
B016LO8EWE,"PEDIGREE Complete Nutrition Adult Dry Dog Food Roasted Chicken, Rice &amp; Vegetable Flavor, 3.5 lb. Bag"
B016LO8ZCI,NUTRO MAX CAT Kitten Roasted Chicken Flavor Dry Cat Food 3 Pounds
B016LO9FJK,NUTRO MAX CAT Indoor Adult Roasted Chicken Flavor Dry Cat Food 3 Pounds
B016LO984C,"NUTRO Small Breed Weight Management Chicken, Whole Brown Rice &amp; Oatmeal Recipe Dog Food 4 lbs."
B016LO9BQW,"NUTRO Senior Chicken, Whole Brown Rice and Oatmeal Recipe Dog Food 5 Pounds"
B016LO7UHY,GREENIES Grain-free Petite Dog Dental Chews - 27 Ounces 45 Treats
B016LO8KXW,ULTRA Large Breed Adult Dry Dog Food 15 Pounds
B016LO7HN6,"Greenies Dental Dog Treats Teenie Size, Original Flavor (12 Ounces. 43 Treats) Greenies Dog Dental Chews: For Clean Teeth and Healthy Gums"
B016LO8T60,"NUTRO Wholesome Essentials Puppy, Farm-Raised Chicken, Brown Rice &amp; Sweet Potato dog food 15lb bag"
B016LO7Z8I,GREENIES Blueberry Flavor Large Dog Dental Chews  - 12 Ounces 8 Treats
B016LO7SJY,GREENIES Grain-free Regular Size Dog Dental Chews - 27 Ounces 27 Treats
B016LO961C,ULTRA Small Breed Senior Dry Dog Food 8 Pounds
B016M2TC0S,M&amp;M'S Christmas Peanut Chocolate Candy Party Size 42-Ounce Bag
B016M2UIG0,MILKY WAY Holiday Milk Chocolate Minis Size Christmas Candy Bars 11.5-Ounce Bag
B016M2TG1S,SNICKERS Slice n' Share Giant Chocolate Candy Bar 1-Pound Bar Christmas Gift
B016M2T34I,M&amp;M'S Christmas Milk Chocolate Candy Party Size 42-Ounce Bag
B016NZX2P0,"Blue Sky Free Cola, 12 Fluid Ounce (Pack of 6)"
B016O4H1ZM,"Best Foods Mayonnaise Dressing, with Olive Oil, 15 oz"
B016O4GGYO,"Best Foods Mayonnaise, Real, 30 oz"
B016O4HA12,"Best Foods Mayonnaise, Real, 15 oz"
B016OA513A,"Kitchens Of India Paste, Chicken Curry, 3.5-Ounces"
B016OA4X16,"Kitchens Of India Ready To Eat Pindi Chana, Chick Pea Curry, 10-Ounces"
B016OA54HI,"Kitchens Of India Paste, Tikka Masala, 3.5-Ounces"
B016OA5CN4,"Knorr Aromat Seasoning, 3 Ounce"
B016OH0K70,Glad ForceFlex Tall Kitchen Antimicrobial Drawstring Trash Bags - Unscented - 13 Gallon - 34 Count
B016PNPMZI,"L'Or&eacute;al Paris Voluminous Million Lashes Excess Washable Mascara, Black, 0.31 fl. oz."
B016PNOTL6,"L'Oreal Paris Age Perfect Cell Renewal Night Cream, 1.7 Ounce"
B016PNOQH8,L'Oreal Paris Age Perfect Cell Renewal Facial Day Cream SPF 15
B016PNQT14,"Maybelline Brow Precise Shaping Eyebrow Pencil, Deep Brown, 0.02 oz."
B016PNONVM,"L'Or&eacute;al Paris Age Perfect Cell Renewal Face Serum with LHA. Skin feels firmer, younger. 1 fl. oz."
B016PNQKEK,"L'Or&eacute;al Paris Colour Riche Collection Exclusive Lipstick, Liya's Red, 0.13 oz."
B016PNP5Z0,"L'Or&eacute;al Paris Colour Riche Lip Gloss, Soft Pink, 0.23 fl. oz."
B016PNNSHM,L'Oreal Paris RevitaLift Triple Power Concentrated Facial Serum Treatment
B016RY1AXS,"Taylors of Harrogate English Breakfast, 50 Teabags"
B016RY55X4,"Bai Bubbles, Sparkling Water, Gimbi Pink Grapefruit, Antioxidant Infused Drinks, 11.5 Fluid Ounce Cans, 12 count"
B016RY174K,"Taylors of Harrogate Yorkshire Red, 100 Teabags"
B016RY58OU,"Bai Bubbles, Sparkling Water, Jamaica Blood Orange, Antioxidant Infused Drinks, 11.5 Fluid Ounce Cans, 12 count"
B016RY3R52,"RUNA Clean Energy Organic Guayusa Loose Leaf Tea, Hibiscus Berry, 2.5 Ounce"
B016RY44AO,Stash Tea Pomegranate Raspberry Green Tea 100 Count (Packaging May Vary)
B016RY9E0Y,"Davidson's Tea Sun, Moon and Stars Tea, 16 Ounce"
B016RYB7TU,"ROLO Chocolate Caramel Candy, 19.75 Ounce"
B016RY9BTS,"Custom Variety Pack Tea Deluxe Count for Keurig K-Cup Brewers, 20 Count"
B016RYBCKY,"Peter Rabbit Organics Banana, Mango, Broccoli and Kale Puree, 4.4 Ounce Pouches (Pack of 10)"
B016RY61R8,"Celsius Sparkling Energy Drink, Wild Berry, 12 Fluid Ounce (Pack of 12) (Packaging may vary)"
B016RY10QA,"Taylors of Harrogate Yorkshire Gold, 160 Teabags"
B016RY9ZE4,"Diamond of California, Shelled Walnuts, 10 Ounce"
B016RY8ZZE,"KIND Healthy Grains Bars, Dark Chocolate Mocha, Non GMO, Gluten Free, 1.2 oz, 15 Count"
B016RYATHG,"YORK Dark Chocolate Peppermint Candy (Patties), 5.25 Pounds"
B016RYANAO,"HERSHEY'S Ovation Dark Chocolate Mint Candy Sticks Gift, 35.2 Ounce"
B016RY1RMC,"Davidson's Tea Green Tea Garden, 16 Ounce"
B016RY70A0,"Orgain Organic Protein Shake, Vanilla Bean, 11 Ounce, 12 Count"
B016RY3HJS,"Numi Organic Tea Aged Earl Grey Tea, Loose Leaf, 16 Ounce"
B016RYA4YO,"GoPicnic Copper Cowbell Asiago Gourmet Cheese Spread, Portion Cups, 10 Count"
B016S14U7I,"JELL-O Gelatin Dessert, Lemon, 3 Ounce"
B016SCDMS0,"Brawny Giant Roll Paper Towel, 2 ct"
B016UB97LA,"Pace Ready Meals, Fiesta Chicken and Rice with Green &amp; Red Peppers, 9 oz (Pack of 6)"
B016UB9D9G,"Pace Ready Meals, Cheesy Chicken Quesadilla, 9 Ounce (Pack of 6)"
B016UB8TDW,"Prego Ready Meals, Creamy Three Cheese Alfredo Rotini, 9 oz (Pack of 6)"
B016UB9PZS,"Prego Ready Meals, Marinara &amp; Italian Sausage Rotini, 9 oz (Pack of 6)"
B016UBA2A0,"Prego Ready Meals, Roasted Tomato &amp; Vegetable Penne, 9 Ounce (Pack of 6)"
B016UBABC4,"Prego Ready Meals, Creamy Tomato Penne, 9 Ounce (Pack of 6) (Packaging May Vary)"
B016UB9WN8,"Pace Ready Meals, Southwest Style Chicken with Corn &amp; Beans, 9 Ounce (Pack of 6)"
B016VXJQ0Y,"Zola Coconut Water with Espresso, 17.5 Ounce (Pack of 12)"
B016WHR8YU,Oral-B Electric Toothbrush
B016WK6XMA,Combos Variety Pack Fun Size Baked Snacks 0.93-Ounce Bag 12-Count Box
B016XNAR14,"Plum Organics Baby Super Puffs, Blueberry and Purple Sweet Potato, 1.5 Ounce Containers (Pack of 8)"
B016XR522E,"Plum Kids Organic Fruit Shredz, Berry'licious, 3.15 Ounce"
B016XR4BHG,"Plum Organics Mashups, Organic Kids Applesauce, Strawberry &amp; Beet, 3.17 ounce pouch, 4 count"
B016XR5Q20,"Plum Organics Baby Hello Dinner, Pumpkin/Spinach/Quinoa, 5 Count"
B016XR4SCY,"Plum Organics Mashups, Organic Kids Applesauce, Strawberry Blackberry &amp; Blueberry, 3.17 ounce pouch, 4 count"
B016XZCP26,California Delicious Kosher Blue Gift Tower
B016XZG04K,Golden State Fruit Holiday Premium Handmade Chocolate Collection in Gift Tin
B016ZKRRLS,"Blue Sky Organic Ginger Ale, 12 Fluid Ounce (Pack of 6)"
B016ZNJG7I,ELEMENT SNACKS RICE CAKE-DARK CHOC 3 3.5OZ
B016ZSMJEK,"Plum Organics Stage 2, Organic Baby Food, Apple and Carrot, 4 ounce pouch (Pack of 6)"
B016ZSOOJS,"Plum Organics Mighty Veggie, Organic Toddler Food, Spinach Banana Parsnip Grape &amp; Amaranth, 4 ounce pouch (Pack of 6)"
B016ZSO466,"Plum Organics Mighty Morning, Organic Toddler Food, Banana Blueberry Oat &amp; Quinoa, 3.17 ounce pouch (Pack of 6)"
B016ZSMOE0,"Plum Organics Stage 2, Organic Baby Food, Pear Purple Carrot and Blueberry, 4.0 ounce pouch (Pack of 6)"
B016ZSOTEI,"Plum Organics Mighty Veggie, Organic Toddler Food, Zucchini Apple Watermelon &amp; Barley, 4 ounce pouch (Pack of 6)"
B016ZSM5S0,"Plum Organics Stage 2, Organic Baby Food, Apple Raisin and Quinoa, 3.5 ounce pouch (Pack of 6)"
B016ZSOF24,"Plum Organics Mighty 4, Organic Toddler Food, Cherry Strawberry Black Bean Spinach and Oat, 4.0 ounce pouch (Pack of 6)"
B016ZSN3GI,"Plum Organics Stage 2, Organic Baby Food, Pear and Mango, 4 ounce pouch (Pack of 6)"
B016ZSOJ84,"Plum Organics Mighty Veggie, Organic Toddler Food, Carrot Pear Pomegranate &amp; Oats, 4 ounce pouch (Pack of 6)"
B0171D78AS,"Acqua Panna Natural Spring Water, 16.9-ounce plastic bottles (Pack of 6)"
B01760ZKZ6,"Sahale Snacks Nut Blends Cashew Mix, Raspberry Crumble, 8 Ounce"
B01760ZIVC,"Sahale Snacks Nut Blends Almond Trail Mix, Berry Macaroon, Gluten-Free Snack,7 Ounces"
B0176103MU,"Bare Natural Apple Chips, Fuji &amp; Reds, Gluten Free + Baked, Single Serve Bag - 1.7 Oz"
B0176105YG,"Bare Natural Apple Chips, Single Serve Granny Smith, Gluten Free + Baked, 1.7 Oz"
B01760ZDYY,"Sahale Snacks Thai Cashews Glazed Mix, Gluten-Free Snack, 4-Ounce"
B01760ZGHS,"Sahale Snacks Balsamic Almonds Glazed Mix, Gluten-Free Snack, 4 Ounces"
B0177N20Y6,"Pringles Cheese Burger, 6 Ounce"
B0177VSJ2A,Mars Chocolate Minis Size Candy Variety Mix 17.5-Ounce Bag
B0177VS1NM,MARS Chocolate Singles Size Halloween Candy Bars Variety Pack 33.31-Ounce 18-Count Box
B0177VSG78,MARS Chocolate Minis Size Candy Variety Mix 40-Ounce Bag
B0177VSD7G,SNICKERS Variety Mix Fun Size Chocolate Candy Bars 35.09-Ounce Bag
B0177VRW8C,MARS Chocolate Favorites Fun Size Halloween Candy Bars Variety Mix 33.9-Ounce 60-Piece Bag
B01782IN10,"Skittles Original and Starburst Original Candy Easter Laydown Bag, 57 Fun Size Pieces"
B01782IK5E,"Skittles Original and Starburst Original Candy Filled Easter Eggs, 12 Eggs in Bag"
B01782ISL0,Starburst Original Jellybeans Candy Easter 39 Ounce Stand Up Bag
B01782I8AG,"Starburst Original Jellybeans Easter Candy, 14 Ounce Bag"
B01782IPU4,"Starburst Original Fun Size Candy, Easter Mix, 7.3 Ounce Bag"
B017835JPC,"Jack Links Snack Packs, Teriyaki, 3.12 Ounce"
B01781IA6O,"Starburst Original Fruit Chews Sweet Selfie Candy Book, 6.8 ounce"
B0179BKHRI,"Taylors of Harrogate Yorkshire Red, 10 Teabags"
B017BGL4WS,Conair 1875 Watt Dual Voltage Folding Handle Hair Dryer
B017BGLIEW,Eucerin Daily Protection Broad Spectrum SPF 30 Sunscreen Moisturizing Face Lotion 4 Fluid Ounce
B017BGK5ZU,"Burt's Bees Hand Repair Gift Set, 3 Hand Creams plus Gloves &ndash; Almond Milk Hand Cream, Lemon Butter Cuticle Cream, Shea Butter Hand Repair Cream"
B017BGKDNE,"Burt's Bees 100% Natural Moisturizing Lip Shimmer, Plum - 1 Tube"
B017BGJLBE,Aquaphor Advanced Therapy Healing Ointment Skin Protectant 14 Ounce Jar
B017BGMJ4A,"Mederma PM Intensive Overnight Scar Cream, 1 Ounce"
B017BGKAY6,"Burt's Bees 100% Natural Moisturizing Lip Shimmer, Guava - 1 Tube"
B017BGMX0K,Olay ProX Microdermabrasion Plus Advanced Cleansing System
B017BGNDZY,"Pantene Daily Moisture Renewal Shampoo, 25.4 Fluid Ounce"
B017BGMD4Q,"Maybelline New York The Blushed Nudes, 0.34 Ounce"
B017BGLFBS,"Crest 3D White Whitestrips Glamorous White Teeth Whitening Kit, 14 Count"
B017BGKJSI,"Burt's Bees Radiance Facial Cleanser, 6 Ounces"
B017BGOCAO,Revlon Perfect Heat Fast Dry Speed Hair Dryer
B017BGMOTK,"Neutrogena Hydro Boost Hyaluronic Acid Hydrating Face Moisturizer Gel-Cream to Hydrate and Smooth Extra-Dry Skin, 1.7 oz"
B017BGJOGG,"Biotene Fresh Mint Moisturizing Oral Rinse Mouthwash, Alcohol-Free, for Dry Mouth, 33.8 ounce"
B017BGMRU6,"Neutrogena Wet Skin Kids Water Resistant Sunscreen Stick for Face and Body, Broad Spectrum SPF 70, 0.47 oz"
B017BGOM3G,"Scunci Effortless Beauty Large No-Damage Elastics, 36 Count"
B017BGMYDG,"Olay Total Effects 7-in-1 Anti-Aging UV Moisturizer SPF 15, 1.7 Fl Oz"
B017BGOFGU,Schick Hydro Silk Trim Style Razor and Bikini Trimmer
B017BKCZ9K,Red Bull Energy Drink 12 Pack of 8.4 Fl Oz
B017BJJXXM,"Honest Fizz Zero Calorie Soda (Professor Fizz, 12-Ounce Cans, Pack of 6)"
B017BJJN1O,"Honest Fizz Zero Calorie Soda (Orange Pop, 12-Ounce Cans, Pack of 6)"
B017BKD6FM,"Red Bull Energy Drink Sugar Free 12 Pack of 8.4 Fl Oz, Sugarfree"
B017D0LIGY,"18 Rabbits Jr. Organic Gluten Free Granola Bar, Chocolate Cherry, 6.3 Ounce"
B017D0MBMY,"18 Rabbits Organic Gracious Granola, Pecan, Almond and Coconut, 11 Ounce bag"
B017D0L7ME,"18 Rabbits Jr. Organic Gluten Free Granola Bar, Chocolate Banana, 6.3 Ounce"
B017D0LSFU,"18 Rabbits Jr. Organic Gluten Free Granola Bar, Mango Strawberry, 6.3 Ounce"
B017D0MSYA,"18 Rabbits Organic Felicitas Granola, Cherry, Chia and Vanilla, 12 Ounce bag"
B017DF6NK0,"Jack Link&rsquo;s Beef Jerky Variety Bag Original, Teriyaki 9ct 1.25oz Single-serve Bags"
B017DF6SBO,"Jack Link&rsquo;s Original Turkey Jerky Snack Packs, 4.25 Ounce (Packaging May Vary)"
B017DF6KZS,"Jack Link&rsquo;s Beef Jerky, Hickory Smoked, 16 Ounce"
B017DF6II2,"Jack Link&rsquo;s Beef Jerky, Teriyaki, 16 Ounce"
B017DF6VA2,"Jack Links Original Beef Steaks, 12 Ounce"
B017DF6COW,"Jack Link&rsquo;s Beef Jerky, Sweet &amp; Hot, 16 Ounce"
B017DF6PUS,"Jack Links Snack Packs, Original, 3.125 Ounce"
B017II4VME,"Fabuloso All-Purpose Cleaner with Bleach Alternative, Spring Fresh - 33.8 fluid ounce"
B017II5CPY,"Suavitel Fast Dry Fabric Conditioner Sheets, Magical Morning Sun, 70 Count"
B017II57EA,"Fabuloso All-Purpose Cleaner, Lavender - 90 fluid ounce"
B017II543E,"Murphy's Oil Wet Disposable Soft Wipes, Large, 18 Count"
B017ILEKGS,"Quinn Snacks Microwave Popcorn - Made with Organic Non-GMO Corn - Great Snack Food for Movie Night - Parmesan &amp; Rosemary, 7 Ounce"
B017ILECPW,"Quinn Snacks Microwave Popcorn - Made with Organic Non-GMO Corn - Great Snack Food for Movie Night - Butter &amp; Sea Salt, 6.9 Ounce"
B017ILEQPI,"Quinn Snacks Microwave Popcorn - Made with Organic Non-GMO Corn - Great Snack Food for Movie Night - Vermont Maple &amp; Sea Salt, 7 Ounce"
B017ILH01K,"The Peanut Shop of Williamsburg All Natural Pistachios, 5 Ounce"
B017ILH2E0,"The Peanut Shop of Williamsburg Handcooked Virginia Peanuts, 10.5 Ounce"
B017ILENJW,"Quinn Snacks Microwave Popcorn - Made with Organic Non-GMO Corn - Great Snack Food for Movie Night - Just Sea Salt, 7 Ounce"
B017ILGC8C,"The Peanut Shop of Williamsburg Hot Habanero Chile Pepper Nuts, 10.5 Ounce"
B017K7FDAM,"Quinn Snacks Farm-to-Bag Non-GMO and Gluten Free Popcorn, Coconut Oil &amp; Sea Salt, 4 Ounce"
B017K9F75G,"Propel Water Mandarin Orange Flavored Water With Electrolytes, Vitamins and No Sugar 16.9 Ounces (Pack of 6)"
B017NF3D6C,"Keebler Club Crackers, Original, 13.7 oz Box"
B017W3JMNS,"Face Moisturizer by Olay Total Effects Anti-Aging Face Moisturizer, Fragrance-Free 1.7 fl oz"
B017W3K4IA,"Braun Silk-&eacute;pil 3-3170 Women's Epilator, Electric Hair Removal, White/Purple"
B017W3JPL2,"Dark Spot Corrector by Olay, Professional ProX Age Repair Lotion with Sunscreen Broad Spectrum SPF 30, 2.5 Fluid Ounce"
B017W3JC5Q,"Burt's Bees Aloe and Coconut Oil After Sun Soother, Sunburn Relief Lotion - 6 Ounce Bottle"
B017W3J8TQ,"Neutrogena Hydro Boost Hyaluronic Acid Hydrating Water Face Gel Moisturizer for Dry Skin, 1.7 fl. oz"
B017WAGLLC,"Stacy's Toasted Garlic Bagel Chips, 7 Ounce Bag"
B017WAGFTU,"Stacy's Simply Naked Bagel Chips, 7 Ounce Bag"
B017WGIDBC,"SlimFast Advanced Nutrition High Protein Smoothie Powder, Vanilla Cream, 11.01 Ounce"
B017WGIIW6,"SlimFast Advanced Nutrition, Meal Replacement Shake, High Protein, Creamy Chocolate, 11 Ounce, 4 Count"
B017WGIU38,"SlimFast Advanced Nutrition, Meal Replacement Shake, High Protein, Vanilla Cream, 11 Ounce, 4 Count"
B017WGIG4Q,"SlimFast Advanced Nutrition 100 Calorie Snacks, Drizzled Crisps, Cinnamon Bun Swirl, 5 Count"
B017WGIAL0,"Slim Fast Advanced Nutrition Meal Replacement Bar, Dark Chocolate Sea Salt, 4 Count"
B017WGI5BU,"SlimFast Advanced Nutrition 100 Calorie Snacks, Baked Crisps, Mesquite BBQ, 5 Count"
B017WGIOI4,"SlimFast Advanced Nutrition 100 Calorie Snack Bites, Peanut Butter Chocolate, 5 Count"
B017WGIZZ6,"SlimFast Advanced Nutrition High Protein Smoothie Powder, Creamy Chocolate, 11.01 Ounce"
B017WGJ2SA,"SlimFast Advanced Nutrition, Meal Replacement Shake, High Protein, Strawberries &amp; Cream, 11 Ounce, 4 Count"
B017WGHVY2,"Slim Fast Original, Meal Replacement Shake, Strawberries and Cream, 11 Ounce, 8 Count"
B017WGIWWM,"SlimFast Advanced Nutrition 100 Calorie Snacks, Baked Crisps, Sour Cream &amp; Onion, 5 Count"
B017WGIRA4,"SlimFast Advanced Energy, Meal Replacement Shake, High Protein, Caramel Latte, 11 Ounce, 4 Count"
B017WGHSQS,"SlimFast Original, Meal Replacement Shakes, Rich Chocolate Royale, 11 oz Bottle - 8 Count"
B017WGHHLY,"Slim Fast Original weight loss Meal Replacement RTD shakes with 10g of protein and 5g of fiber plus 24 Vitamins and Minerals per serving, French Vanilla,  8 Count"
B017WGI2BI,"SlimFast Original - Weight Loss Meal Replacement RTD Shakes - With 10g Of Protein &amp; 5g Of Fiber - Plus 24 Vitamins and Minerals per serving - Creamy Milk Chocolate, 8 Count"
B017WGHZ48,"SlimFast Original - Weight Loss Meal Replacement RTD Shakes - With 10g Of Protein &amp; 5g Of Fiber - Plus 24 Vitamins and Minerals per serving - Cappuccino Delight, 8 Count"
B017WGILT6,"SlimFast Advanced Nutrition 100 Calorie Snacks, Drizzled Crisps, S'mores, 5 Count"
B017XGRCWC,"Coca-Cola Life Soda Soft Drink, 12 fl oz, 6 Pack"
B017XKIUHY,"Bisquick Shake N Pour, 10.6 Ounce"
B017XKJLDQ,Betty Crocker Super Moist Cake Mix White 16.25 oz Box
B017XKK5UO,"Betty Crocker Baking Mix, Super Moist Fat Free Cake Mix, Angel Food, 16 Oz Box"
B017XKIXTY,"Bisquick Heart Smart Baking Mix, 40 Ounce"
B017XKJYRE,Betty Crocker Super Moist Cake Mix Devil's Food 15.25 oz Box
B017XKKURM,"Betty Crocker Baking Mix, Oatmeal Chocolate Chip Cookie Mix, 17.5 Oz Pouch"
B017XKIR3G,"Bisquick Baking Mix, Original All-Purpose, 60 Ounce"
B017XKJOQA,"Betty Crocker Baking Mix, Peanut Butter Cookie Mix, 17.5 Oz Pouch"
B017XKKKJA,"Betty Crocker Delights, Supreme Walnut Brownie Mix, 16.5 Oz Box"
B017XKLI5U,"Betty Crocker Baking Mix, Oatmeal Cookie Mix, 17.5 Oz Pouch"
B017XKJV3G,"Betty Crocker Supreme Brownie Mix, Original, 18.4 Ounce"
B017XKKHHK,"Betty Crocker Frosting, Rich &amp; Creamy Gluten Free Frosting, Milk Chocolate, 16 oz Canister"
B017XKJ4GU,"Betty Crocker Bisquick Baking Mix, Shake 'N Pour Pancake Mix, Buttermilk, 5.1 Oz Bottle"
B017XKN1FK,"Annie's Macaroni and Cheese, Shells &amp; Aged Cheddar Mac and Cheese, 6 oz Box (Pack of 3)"
B017XKN5RO,"Betty Crocker Hamburger Helper, Four Cheese Lasagna Hamburger Helper, 5.5 Oz Box"
B017XKJ7BM,Betty Crocker Brownie Mix Fudge Family Size 18.3 oz Box
B017XKLLSY,"Betty Crocker Frosting, Whipped Gluten Free Frosting, Butter Cream, 12 Oz Canister"
B017XKND6W,"Betty Crocker Suddenly Salad, Caesar Pasta Salad Dry Meals, 7.25 Oz Box"
B017XKNNOE,"Betty Crocker Hamburger Helper, Cheesy Italian Shells Hamburger Helper, 6.1 Oz Box"
B017XKL7RO,"Betty Crocker Whipped Frosting, Cream Cheese, 12 oz Canister"
B017XKLBPM,"Betty Crocker Baking Mix, Dark Chocolate Brownie Mix, Family Size, 19.9 Oz Box"
B017XKJAZA,Betty Crocker Muffin &amp; Quick Bread Mix Wild Blueberry 16.9 oz Box
B017XKN9F2,"Betty Crocker Hamburger Helper, Deluxe Cheeseburger Macaroni Hamburger Helper, 5.5 Oz Box"
B017XKK9DM,"Betty Crocker Baking Mix, Milk Chocolate Brownie Mix, Family Size, 18.4 Oz Box"
B017XKOKD2,"Annie's Macaroni and Cheese, Microwave Cups, Pasta &amp; Real Aged Cheddar Mac and Cheese"
B017XKK2CU,Betty Crocker Super Moist Cake Mix Butter Recipe Yellow 15.25 oz Box
B017XKOT6A,"Annie's White Cheddar Microwavable Macaroni &amp; Cheese, 2 cups, 2.01oz(2 Pack)"
B017XKKDDI,"Betty Crocker Baking Mix, Super Moist Cake Mix, Chocolate Fudge, 15.25 Oz Box"
B017XKMI6S,"Gold Medal Better for Bread Flour, 5 Pound"
B017XKLF08,"Betty Crocker Frosting, Rich &amp; Creamy Gluten Free Frosting, Coconut Pecan, 15.5 Oz Canister"
B017XKNRXQ,"Betty Crocker Hamburger Helper, Philly Cheesesteak Hamburger Helper, 6.5 Oz. Box"
B017XKL54Y,"Betty Crocker Baking Mix, Super Moist Cake Mix, French Vanilla, 15.25 Oz Box"
B017XKPK2C,Old El Paso Taco Mild Seasoning Mix 1 oz Packet
B017XKPH8O,Old El Paso Fajita Dinner Kit
B017XKO9CE,"Betty Crocker, Chicken Helper, Chicken Fried Rice, 7 oz"
B017XKKYN2,"Betty Crocker Baking Mix, Super Moist Cake Mix, Triple Chocolate Fudge, 15.25 Oz Box"
B017XKP52M,"Old El Paso Taco Dinner Kit, Hard &amp; Soft, 11.4 oz Box"
B017XKPBVC,"Old El Paso Taco Dinner Kit, Stand 'n Stuff, 8.8 oz Box"
B017XKNVFK,"Betty Crocker Hamburger Helper, Bacon Cheeseburger Hamburger Helper, 5.1 Oz Box"
B017XKQ5OO,"Old El Paso Crunchy Taco Shells, Family Pack, 6.89 Ounce"
B017XKPPRW,"Old El Paso Taco Seasoning Mix, 25% Less Sodium, 1 oz Packet"
B017XKP2W0,Old El Paso Taco Original Seasoning Mix 1 oz Packet
B017XKNYSY,"Betty Crocker, Tuna Helper, Tuna Cheesy Pasta, 5.3 oz"
B017XKONA2,"Annie's Macaroni &amp; Cheese, Real Aged Cheddar Mac and Cheese, Microwavable Cups, 1 Cup, 2.01 oz"
B017XKQXW8,"Progresso Soup, Low Fat Light, Chicken Noodle Soup, 18.5 oz Can"
B017XKPN1A,"Old El Paso Soft Tortilla Bowl, Flour, 8 Count"
B017XKL1YI,"Betty Crocker Frosting, Whipped Gluten Free Frosting, Fluffy White, 12 Oz Canister"
B017XKNH0E,"Betty Crocker Hamburger Helper, Three Cheese Hamburger Helper, 6 Oz Box"
B017XKREIA,"Progresso Soup, Rich &amp; Hearty, Hearty Chicken Pot Pie Style Soup, 18.5 oz Can"
B017XKQ846,"Old El Paso Refried Beans, Traditional, 31 oz Can"
B017XKP8WY,Old El Paso Traditional Refried Beans 16 oz Can
B017XKQG16,Old El Paso Stand 'n Stuff Bold Nacho Cheese Flavored Taco Dinner Kit 9.5 oz Box
B017XKRLUG,"Progresso Soup, Low Fat Light, New England Clam Chowder, Gluten Free, 18.5 oz Can"
B017XKRODK,"Progresso Soup, Traditional, Beef Barley Soup, 19 oz Can"
B017XKPYKU,"Old El Paso Soft Tacos &amp; Fajitas Shells, 8.2 oz Bag"
B017XKQSU0,"Old El Paso Enchilada Sauce, Mild, Red, 28 oz Can"
B017XKO1YU,"Betty Crocker, Tuna Helper, Tuna Creamy Broccoli, 6.4 oz"
B017XKRTKI,"Progresso Soup, Traditional, Chicken and Herb Dumplings Soup, 18.5 oz Can"
B017XKR3NG,"Progresso Soups Vegetable Classics Soup, Tomato Basil, 19 Ounce"
B017XKQO40,"Old El Paso Enchilada Sauce, Medium, Red, 10 oz Can"
B017XKRJKS,"Progresso Soup, Traditional, Chickarina Soup, 19 oz Can"
B017XKS40M,"Progresso Soup, Low Fat Light, Savory Vegetable Barley Soup, 18.5 oz Can"
B017XKR9F8,"Progresso Soup, Rich &amp; Hearty, Loaded Potato with Bacon Soup, 18.5 oz Can"
B017XKQ39G,"Old El Paso Taco Dinner Kit, Crunchy, 8.8 oz Box"
B017XKRYNA,"Progresso Soup, Vegetable Classics, Creamy Mushroom Soup, Gluten Free, 18 oz Can"
B017XKLV3O,"Betty Crocker Whipped Frosting, Vanilla, 12 oz Canister"
B017XKODDE,"Annie's Macaroni &amp; Cheese, Gluten Free Rice Shell Pasta &amp; Creamy White Cheddar, 6oz Box"
B017XKSKBA,"Progresso Soup, Cooking Vegetable Stock, 32 oz Carton"
B017XKM4X0,"Gold Medal Enriched Bleached Presifted Flour, All-Purpose, 5 Pound"
B017XKJ1GS,"Bisquick Pancake and Baking Mix, 20 Ounce"
B017XKQLPC,"Old El Paso Refried Beans, Vegetarian, 16 oz Can"
B017XKOW6C,"Annie's Macaroni and Cheese, Microwave Cups, Pasta &amp; White Cheddar Mac and Cheese, 2.01 oz Cup"
B017XKRW6O,"Progresso Soup, Reduced Sodium, Creamy Tomato Basil Soup, 19 oz Can"
B017XKS16Y,"Progresso Soup, Reduced Sodium, Chicken and Wild Rice Soup, 18.5 oz Can"
B017XKSTIO,"Betty Crocker Fruit Snacks, SpongeBob SquarePants Snacks, 10 Pouches, 0.8 oz Each"
B017XKQIWS,Old El Paso Hard and Soft Taco Shells 12 ct 7.4 oz Box
B017XKTA46,"Betty Crocker Fruit Snacks, Fruit Roll-Ups, Variety Snack Pack, 10 Rolls, 0.5 oz Each"
B017XKSVV4,"Betty Crocker Fruit Snacks, Teenage Mutant Ninja Turtles Snacks, 10 Pouches, 0.8 oz Each"
B017XKQUXU,"Progresso Soup, Traditional, Chicken Noodle Soup, 19 oz Can"
B017XKT32U,"Betty Crocker Fruit Snacks, Scooby Doo Snacks, 10 Pouches, 0.8 oz Each"
B017XKOZ5U,"Progresso Plain Bread Crumbs, 15 oz"
B017XKR6N8,"Progresso Soup, Traditional, 99% Fat Free Chicken Noodle Soup, 19 oz Can"
B017XKPVR6,Old El Paso Chopped Chiles 4.5 oz Can
B017XKTEYC,"Betty Crocker Fruit Flavored Snacks, Fruit Roll-Ups, Fruit Gushers, Fruit by the Foot Variety Pack, 5.3 Ounce"
B017XKOQ5Y,"Annie's Macaroni &amp; Cheese, Gluten Free Creamy Deluxe &amp; Cheesy Cheddar, Rice Pasta &amp; Cheese Sauce, 11oz Box"
B017XKTCMG,"Betty Crocker Fruit Snacks, Fruit By The Foot, Variety Snack Pack, 6 Rolls, 0.75 oz Each"
B017XKQDHS,"Old El Paso Extra Large Taco Shells, Super Stuffer, 10 Count"
B017XKTHM6,"Mott's Medleys Fruit Snacks, Assorted Fruit Gluten Free Snacks, Value Pack, 24 Pouches, 0.8 oz Each"
B017XKNL00,Betty Crocker Hamburger Helper Deluxe Beef Stroganoff 5.5 oz Box
B017XKTNIO,"Betty Crocker Fruit Snacks, Fruit Roll-Ups, Fruit By The Foot and Fruit Gushers, Variety Snack Pack, 16 Pouches"
B017XKRGWE,"Progresso Soup, Traditional, Chicken Rice with Vegetables Soup, Gluten Free, 19 oz Can"
B017XKQALM,"Old El Paso Taco Shells, Stand 'n Stuff, 15 Count"
B017XKSP0G,"Progresso Soup, Cooking Chicken Stock, 32 oz Carton"
B017XLFTTU,"Betty Crocker Baking Mix, Super Moist Cake Mix, Lemon, 15.25 Oz Box"
